hadithNumber,englishNarrator,hadithEnglish,chapterEnglish,bookName,volume,status
3375,Abu Huraira ( رضی اللہ تعالیٰ عنہ) reported:,Allah's Messenger ( ‌صلی ‌اللہ ‌علیہ ‌وسلم ‌) as saying: Prayer in my mosque is more excellent than a thousand prayers observed in other mosques except the Masjid al-Haram.,The Book of Pilgrimage,Sahih Muslim,3,Sahih
3376,Abu Huraira (رضی اللہ تعالیٰ عنہ) reported:,"Prayer in the mosque of Allah's Messenger ( ‌صلی ‌اللہ ‌علیہ ‌وسلم ‌) is more excellent than a thousand prayers in other mosques except the Masjid al-Haram, for Allah's Messenger ( ‌صلی ‌اللہ ‌علیہ ‌وسلم ) is the last of the Apostles, and his mosque is the last of the mosques. Abu Salama and Abu Abdullah (two of the narrators in this chain of narrations said: We had no doubt that what Abu Haraira (رضی اللہ تعالیٰ عنہ) had said was from Allah's Messenger ( ‌صلی ‌اللہ ‌علیہ ‌وسلم ), and so we did not like to get an attestation from Abu Huraira رضی اللہ تعالیٰ عنہ about this hadith until Abu Huraira (رضی اللہ تعالیٰ عنہ) died. We discussed it (the issue of getting attestation from Abu Huraira رضی اللہ تعالیٰ عنہ) amongst ourselves and blamed one another as to why we did not talk about it to Abu Huraira رضی اللہ تعالیٰ عنہ regarding it so that he could attribute its transmission to Allah's Messenger ( ‌صلی ‌اللہ ‌علیہ ‌وسلم ‌) in case he had heard It from him. While we were discussing it as we sat with 'Abdullah bin Ibrahim bin Qariz; we made a mention of this hadith, and our omission (in getting its attestation) about its direct transmission by Abu Huraira رضی اللہ تعالیٰ عنہ from him (the Holy Prophet); thereupon Abdullah bin Ibrahim said to us: I bear witness to the fact that I heard Abu Huraira (رضی اللہ تعالیٰ عنہ) say that Allah's Messenger ( ‌صلی ‌اللہ ‌علیہ ‌وسلم ‌) said: I am the last of the Apostles and my mosque is the last of the mosques.",The Book of Pilgrimage,Sahih Muslim,3,Sahih
3377,Yahya bin Sa'id reported:,"I said to Abu Salih: Did you hear Abu Huraira (رضی اللہ تعالیٰ عنہ) making a mention of the excellence of prayer in the mosque of Allah's Messenger ( ‌صلی ‌اللہ ‌علیہ ‌وسلم ‌)? He said: No (I did not hear directly from Abu Huraira رضی اللہ تعالیٰ عنہ), but I heard Abdullah bin Ibrahim bin Qariz; say that' he had heard from Abu Huraira (رضی اللہ تعالیٰ عنہ) that Allah's Messenger ( ‌صلی ‌اللہ ‌علیہ ‌وسلم ‌) had said: Prayer in this mosque of mine is better than a thousand prayers. or. is like one thousand prayers observed in other mosques besides It, except that it be in al-Masjid al-Haram.",The Book of Pilgrimage,Sahih Muslim,3,Sahih
3378,,It was narrated from Yabya bin Sa'id with this chain of transmitters.,The Book of Pilgrimage,Sahih Muslim,3,Sahih
3379,Ibn 'Umar (رضی اللہ تعالیٰ عنہ) reported:,"Allah's Apostle ( ‌صلی ‌اللہ ‌علیہ ‌وسلم ‌) as saying: Prayer in this mosque of mine is better than a thousand prayers (observed in other mosque.) besides it, except that of Masjid al-Haram.",The Book of Pilgrimage,Sahih Muslim,3,Sahih
3380,,A hadith like this has been narrated on the authority of Ubaidullah with the same chain of transmitters.,The Book of Pilgrimage,Sahih Muslim,3,Sahih
3381,,Ibn 'Umar reported: I heard Allah's Messenger ( ‌صلی ‌اللہ ‌علیہ ‌وسلم ‌) saying like this.,The Book of Pilgrimage,Sahih Muslim,3,Sahih
3382,,Ibn Umar رضی اللہ تعالیٰ عنہ narrated from Allah's Apostle ( ‌صلی ‌اللہ ‌علیہ ‌وسلم ‌) a hadith like this.,The Book of Pilgrimage,Sahih Muslim,3,Sahih
3383,Ibn Abbas (رضی اللہ تعالیٰ عنہ) reported:,"A woman fell ill and she said: In case Allah cures me I will certainly go and observe prayer in Bait al-Maqdis. She recovered and so she made preparations to go out (to that place). She came to Maimuna رضی اللہ تعالیٰ عنہا the wife of Allah's Apostle ( ‌صلی ‌اللہ ‌علیہ ‌وسلم ‌). and after greeting her she informed her about it, whereupon she said: Stay here. and eat the provision (which you had made) and observe prayer In the mosque of the Messenger ( ‌صلی ‌اللہ ‌علیہ ‌وسلم ‌) for I heard Allah's Messenger ( ‌صلی ‌اللہ ‌علیہ ‌وسلم ‌) say: Prayer In it is better than a thousand prayers observed in other mosques except the mosque of the Ka'ba.",The Book of Pilgrimage,Sahih Muslim,3,Sahih
3384,Abu Hurairah ( رضی اللہ تعالیٰ عنہ) reported:,"It directly from Allah's Apostle ( ‌صلی ‌اللہ ‌علیہ ‌وسلم ‌) that he said: Do not undertake a journey to visit any Mosque, but three: this Mosque of mine, the Mosque of al-Haram and the Mosque of Aqsa (Bait al-Maqdis).",The Book of Pilgrimage,Sahih Muslim,3,Sahih
3385,This hadith has been narrated on the authority of Zuhri (but with this change of words) that he (Allah's Apostle ﷺ) said:,"""Undertake journey to three mosques.""",The Book of Pilgrimage,Sahih Muslim,3,Sahih
3386,Abu Haraira (رضی اللہ تعالیٰ عنہ) reported:,"Allah's Messenger (ﷺ) as saying: One should undertake journey to three mosques: the mosque of the Ka'ba, my mosque, and the mosque of Elia (Bait al-Maqdis).",The Book of Pilgrimage,Sahih Muslim,3,Sahih
3387,Abu Salama bin Abdul-Rahman reported:,"'Abdul-Rabman bin Abu Sa'id al-Khudri (Allah be pleased with him) happened to pass by me and I said to him. How did you hear your father making mention of the mosque founded on Piety? He said: My father said: I went to Allah's Messenger ( ‌صلی ‌اللہ ‌علیہ ‌وسلم ‌) as he was in the house of one of his wives, and said: Messenger of Allah ﷺ, which of the two mosques is founded on piety? Thereupon he took a handful of pebbles and threw them on the ground and then said: This is the very mosque of yours (mosque at Medina). He (the narrator) said: I bear witness that I heard your father making mention of it.",The Book of Pilgrimage,Sahih Muslim,3,Sahih
3388,,"Abu Sa'id رضی اللہ تعالیٰ عنہ reported from Allah's Apostle ( ‌صلی ‌اللہ ‌علیہ ‌وسلم ‌) a hadlth like this, but in the chain of transmitters no mention was made of Abdul-Rahman bin Abu Sa'id رضی اللہ تعالیٰ عنہ .",The Book of Pilgrimage,Sahih Muslim,3,Sahih
3389,Ibn Umar رضی اللہ تعالیٰ عنہ reported:,Allah's Messenger ( ‌صلی ‌اللہ ‌علیہ ‌وسلم ) visited (the mosque) at Quba' riding and on foot.,The Book of Pilgrimage,Sahih Muslim,3,Sahih
3390,Ibn Umar (رضی اللہ عنہ) reported:,"Allah's Messenger ( ‌صلی ‌اللہ ‌علیہ ‌وسلم ) came to the mosque at Quba' riding and on foot, and he observed two rak'ahs of (Nafl prayer) in it.",The Book of Pilgrimage,Sahih Muslim,3,Sahih
3391,Ibn 'Umar reported:,Allah's Messenger ( ‌صلی ‌اللہ ‌علیہ ‌وسلم ‌) came to Quba' riding as well as on foot.,The Book of Pilgrimage,Sahih Muslim,3,Sahih
3392,,"A Hadith like that of Yahya Al-Qattan (as no. 3391) was narrated from Nafi, from Ibn Umar رضی اللہ تعالیٰ عنہ , from the prophet ﷺ.",The Book of Pilgrimage,Sahih Muslim,3,Sahih
3393,Abdullah bin Umar (رضی اللہ تعالیٰ عنہ) reported:,Allah's Messenger ( ‌صلی ‌اللہ ‌علیہ ‌وسلم ‌) used to come to Quba' riding and on foot,The Book of Pilgrimage,Sahih Muslim,3,Sahih
3394,Abdullah bin 'Umar رضی اللہ تعالیٰ عنہ said:,"The Messenger of Allah ﷺ used to go to Quba, riding and walking.",The Book of Pilgrimage,Sahih Muslim,3,Sahih
3395,It was narrated from Abdullah bin Dinar:,Ibn Umar رضی اللہ تعالیٰ عنہ used to come to Quba' on every Saturday and he said: I saw Allah's Apostle ( ‌صلی ‌اللہ ‌علیہ ‌وسلم) coming (to this place) on every Saturday.,The Book of Pilgrimage,Sahih Muslim,3,Sahih
3396,Abdullah bin 'Umar رضی اللہ تعالیٰ عنہ reported:,"Allah's Messenger ( ‌صلی ‌اللہ ‌علیہ ‌وسلم ) used to come to Quba', i.e. (he came) on every Saturday, and he used to come riding or on foot. Ibn Dinar (another narrator) said that Ibn Umar رضی اللہ تعالیٰ عنہ used to do like this.",The Book of Pilgrimage,Sahih Muslim,3,Sahih
3397,This hadith has been narrated on the authority of Ibn Dinar:,But he made no mention of: Every Saturday.,The Book of Pilgrimage,Sahih Muslim,3,Sahih
3398,Alqama reported:,"While I was walking with 'Abdullah at Mina, 'Uthman رضی اللہ عنہ happened to meet him. He stopped there and began to talk with him. Uthman said to him: Abu 'Abdul-Rahman, should we not marry you to a young girl who may recall to you some of the past of your bygone days; thereupon he said: If you say so, Allah's Messenger ( ‌صلی ‌اللہ ‌علیہ ‌وسلم) said: O young men, those among you who can support a wife should marry, for it restrains eyes from casting (evil glances). and preserves one from immorality; but those who cannot should devote themselves to fasting for it is a means of controlling sexual desire.",The Book of Marriage,Sahih Muslim,4,Sahih
3399,Alqama reported:,"While I was going along with 'Abdullah bin Ma'sud (رضی اللہ عنہ) in Mina, 'Uthman bin 'Affan (رضی اللہ عنہ) happened to meet him and said: Come here, Abu 'Abdul-Rahman (kunya of Abdullah bin Mas'ud), and he isolated him (from me), and when 'Abdullah (bin Mas'ud) رضی اللہ عنہ saw that there was no need (for this privacy), he said to me: 'Alqama, come on, and so I went there. (Then) 'Uthman رضی اللہ عنہ said to him: Abu Abdul-Rahman, should we not marry you to a virgin girl that your past may be recalled to your mind? 'Abdullah رضی اللہ عنہ said: If you say so, the rest of the hadith is the same as narrated above.",The Book of Marriage,Sahih Muslim,4,Sahih
