hadithNumber,englishNarrator,hadithEnglish,chapterEnglish,bookName,volume,status
800,Ibn Abbas ‌رضی ‌اللہ ‌عنہ ‌reported:,"The Messenger of Allah ( ‌صلی ‌اللہ ‌علیہ ‌وسلم ‌ ) dressed himself, and then went out for prayer, when he was presented with bread and meat. He took three morsels out of that, and then offered prayer along with other people and did not touch water.",The Book of Menstruation,Sahih Muslim,1,Sahih
801,This hadith is narrated by Muhammad bin 'Amr bin Ata' with these words:,"I was with Ibn 'Abbas رضی ‌اللہ ‌عنہ ‌, and Ibn 'Abbas ‌رضی ‌اللہ ‌عنہ saw the Messenger of Allah ( ‌صلی ‌اللہ ‌علیہ ‌وسلم ‌ ) doing like this, and it is also said that the words are: He (the Holy Prophet) offered prayer; and the word people is not mentioned.",The Book of Menstruation,Sahih Muslim,1,Sahih
802,Jabir bin Samura reported:,"A man asked the Messenger of Allah (may peace he upon him) whether he should perform ablution after (eating) mutton. He (the Messenger of Allah) said: Perform ablution it you so desire, and if you do not wish, do not perform it. He (again) asked: Should I perform ablution (after eating) camel's flesh? He said: Yes, perform ablution (after eating) camel's flesh. He (again) said: May I say prayer in the sheepfolds? He (the Messenger of Allah) said: Yes. He (the narrator) again said: May I say prayer where camels lie down? He (the Holy Prophet) said: No.",The Book of Menstruation,Sahih Muslim,1,Sahih
803,,A Hadith similar to that of Abu Kamil from Abu Awanah was narrated from Jabir bin Samurah ‌رضی ‌اللہ ‌عنہ ‌from the Prophet (ﷺ).,The Book of Menstruation,Sahih Muslim,1,Sahih
804,Abbad bin Tamim reported from his uncle:,A person made a complaint to the Apostle ( ‌صلی ‌اللہ ‌علیہ ‌وسلم ‌ ) that he entertained (doubt) as it something had happened to him breaking his ablution. He (the Holy Prophet) said: He should not return (from prayer) unless he hears a sound or perceives a smell (of passing wind). Abu Bakr and Zuhair bin Harb have pointed out in their narrations that it was 'Abdullah bin Zaid ‌رضی ‌اللہ ‌عنہ ‌.,The Book of Menstruation,Sahih Muslim,1,Sahih
805,Abu Huraira ‌رضی ‌اللہ ‌عنہ ‌reported:,"The Messenger of Allah ( ‌صلی ‌اللہ ‌علیہ ‌وسلم ‌ ) said: If any one of you has pain in his abdomen, but is doubtful whether or not anything has issued from him, be should not leave the mosque unless he hears a sound or perceives a smell.",The Book of Menstruation,Sahih Muslim,1,Sahih
806,It was narrated that Ibn Abbas said:,"The freed slave-girl of Maimuna was given a goat in charity but it died. The Messenger of Allah ( ‌صلی ‌اللہ ‌علیہ ‌وسلم ‌ ) happened to pass by that (carcass). Upon this be said: Why did you not take off its skin? You could put it to use, after tanning it. They (the Companions) said: It was dead. Upon, this he (the Messenger of Allah) said: Only its eating is prohibited. Abu bakr and Ibn Umar in their narrations said: It is narrated from Maimuna ( رضی ‌اللہ ‌عنہا).",The Book of Menstruation,Sahih Muslim,1,Sahih
807,Ibn 'Abbas رضی ‌اللہ ‌عنہ ‌said:,"The Messenger of Allah ( ‌صلی ‌اللہ ‌علیہ ‌وسلم ‌ ) saw a dead goat, which had been given in charity to the freed slave-girl of Maimuna. The Messenger of Allah ( ‌صلی ‌اللہ ‌علیہ ‌وسلم ‌ ) said: Why don't you make use of its skin? They (the Companions around the Holy Prophet) said: It is dead. Upon this he said: It is the eating (of the dead animal) which is prohibited.",The Book of Menstruation,Sahih Muslim,1,Sahih
808,,This hadith is narrated by Ibn Shihab with the same chain of transmitters as transmitted by Yunus.,The Book of Menstruation,Sahih Muslim,1,Sahih
809,Ibn Abbas reported:,The Messenger of Allah ( ‌صلی ‌اللہ ‌علیہ ‌وسلم ‌ ) happened to pass by a goat thrown (away) which had been in fact given to the freed slave-girl of Maimuna as charity. Upon this the Messenger of Allah (way peace he upon him) said: Why did they not get its skin? They had better tan it and make use of it.,The Book of Menstruation,Sahih Muslim,1,Sahih
810,Ibn'Abbas رضی ‌اللہ ‌عنہ reported on the authority of Maimuna:,Someone amongst the wives of the Messenger of Allah ( ‌صلی ‌اللہ ‌علیہ ‌وسلم ‌ ) had a domestic animal and it died. Upon this the Messenger of Allah ( ‌صلی ‌اللہ ‌علیہ ‌وسلم ‌ ) said: Why did you not take off its skin and make use of that?,The Book of Menstruation,Sahih Muslim,1,Sahih
811,Ibn 'Abbas ‌رضی ‌اللہ ‌عنہ ‌reported:,The Apostle of Allah ( ‌صلی ‌اللہ ‌علیہ ‌وسلم ‌ ) happened to pass by (the dead body) of the goat which belonged to the freed slave-girl of Maimuna and said: Why did you not make use of its skin?,The Book of Menstruation,Sahih Muslim,1,Sahih
812,Abdullah bin Abbas said:,I heard the Messenger of Allah ( ‌صلی ‌اللہ ‌علیہ ‌وسلم ‌ ) say: When the skin is tanned it becomes purified.,The Book of Menstruation,Sahih Muslim,1,Sahih
813,,A hadith similar to that of Yahya bin Yahya was narrated from the prophet ﷺ.,The Book of Menstruation,Sahih Muslim,1,Sahih
814,Abu al-Khair reported:,"I saw Ibn Wa'la al-Saba'i wear a fur. I touched it. He said: Why do you touch it? I asked Ibn 'Abbas saying: We are the inhabitants of the western regions, and there (live) with us Berbers and Magians. They bring with them rams and slaughter them, but we do not eat (the meat of the animals) slaughtered by them, and they come with skins full of fat. Upon this Ibn 'Abbas said: We asked the Messenger of Allah ( ‌صلی ‌اللہ ‌علیہ ‌وسلم ) about this and he said: Its tanning makes it pure.",The Book of Menstruation,Sahih Muslim,1,Sahih
815,Ibn Wa'la al-Saba'i reported:,I asked 'Abdullah bin 'Abbas saying: We are the inhabitants of the western regions. The Magians come to us with skins full of water and fat. He said: Drink. I said to him: Is it your own opinion? Ibn Abbas said: I heard the Messenger of Allah ( ‌صلی ‌اللہ ‌علیہ ‌وسلم ‌) say: Tanning purifies it (the skin).,The Book of Menstruation,Sahih Muslim,1,Sahih
816,A'isha reported:,"We went with the Messenger of Allah ( ‌صلی ‌اللہ ‌علیہ ‌وسلم ‌) on one of his journeys and when we reached the place Baida' or Dhat al-jaish, my necklace was broken (and fell somewhere). The Messenger of Allah (way peace be upon him) along with other people stayed there for searching it. There was neither any water at that place nor was there any water with them (the Companions of the Holy Prophet). Some persons came to my father Abu Bakr and said: Do you see what 'A'isha has done? She has detained the Messenger of Allah ( ‌صلی ‌اللہ ‌علیہ ‌وسلم ‌) and persons accompanying him, and there is neither any water here or with them. So Abu Bakr came there and the Messenger of Allah ( ‌صلی ‌اللہ ‌علیہ ‌وسلم ‌) was sleeping with his head on my thigh. He (Abu Bakr) said: You have detained the Messenger of Allah ( ‌صلی ‌اللہ ‌علیہ ‌وسلم ‌) and other persons and there is neither water here nor with them. She ('A'isha) said: Abu Bakr رضی ‌اللہ ‌عنہ ‌scolded me and uttered what Allah wanted him to utter and nudged my hips with his hand. And there was nothing to prevent me from stirring but for the fact that the messenger of Allah ( ‌صلی ‌اللہ ‌علیہ ‌وسلم ‌) was lying upon my thigh. The Messenger of Allah ( ‌صلی ‌اللہ ‌علیہ ‌وسلم ‌) slept till it was dawn at a waterless place. So Allah revealed the verses pertaining to tayammum and they (the Prophet and his Companions) performed tayammum. Usaid bin al-Hudair رضی ‌اللہ ‌عنہ ‌who was one of the leaders said: This is not the first of your blessings,0 Family to Abu Bakr رضی ‌اللہ ‌عنہ ‌. 'A'isha said: We made the came) stand which was my mount and found the necklace under it.",The Book of Menstruation,Sahih Muslim,1,Sahih
817,A'isha reported:,"She had borrowed from Asma' (her sister) a necklace and it was lost. The Messenger of Allah ( ‌صلی ‌اللہ ‌علیہ ‌وسلم ‌) sent men to search for it. As it was the time for prayer, they offered prayer without ablution (as water was not available there). When they came to the Messenger of Allah ( ‌صلی ‌اللہ ‌علیہ ‌وسلم ‌), they made a complaint about it, and the verses pertaining to tayammum were revealed. Upon this Usaid bin Hadair ‌رضی ‌اللہ ‌عنہ said (to 'A'isha): May Allah grant you a good reward! Never has been there an occasion when you were beset with difficulty and Allah did not make you come out of that and made it an occasion of blessing for the Muslims.",The Book of Menstruation,Sahih Muslim,1,Sahih
818,Shaqiq reported:,"I was sitting in the company of Abdullah and Abu Musa when Abu Musa said: O 'Abd al-Rahman (kunya of 'Abdullah bin Mas'ud رضی ‌اللہ ‌عنہ), what would you like a man to do about the prayer if he experiences a seminal emission or has sexual intercourse but does not find water for a month? 'Abdullah رضی ‌اللہ ‌عنہ ‌said: He should not perform tayammum even if he does not find water for a month. 'Abdullah رضی ‌اللہ ‌عنہ ‌said: Then what about the verse in Sura Ma'ida: If you do not find water, betake yourself to clean dust ? 'Abdullah said: If they were granted concession on the basis of this verse, there is a possibility that they would perform tayammum with dust on finding water very cold for themselves. Abu Musa رضی ‌اللہ ‌عنہ ‌said to Abdullah: You have not heard the words of 'Ammar: The Messenger of Allah ( ‌صلی ‌اللہ ‌علیہ ‌وسلم ) sent me on an errand and I had a seminal emission, but could find no water, and rolled myself in dust just as a beast rolls itself. I came to the Messenger of Allah ( ‌صلی ‌اللہ ‌علیہ ‌وسلم ‌) then and made a mention of that to him and he (the Holy Prophet) said: It would have been enough for you to do thus. Then he struck the ground with his hands once and wiped his right hand with the help of his left hand and the exterior of his palms and his face. 'Abdullah رضی ‌اللہ ‌عنہ ‌said: Didn't you see that Umar رضی ‌اللہ ‌عنہ ‌was not fully satisfied with the words of 'Ammar only?",The Book of Menstruation,Sahih Muslim,1,Sahih
819,It was narrated that Shaqiq said:,"""Abu Musa رضی ‌اللہ ‌عنہ ‌said to 'Abdullah...."" and he quoted a hadith similar to that of Abu Muaviyah, except that he said: The Messenger of Allah ﷺ said: ' It would have been sufficient for you to do like this,' and he struck his hands on the ground, then he shook off the dust and wiped his face and hands.""",The Book of Menstruation,Sahih Muslim,1,Sahih
820,Abdul-Rabmin bin Abza narrated It on the authority of his father:,"A man came to 'Umar رضی ‌اللہ ‌عنہ ‌and said: I am (at times) affected by seminal emission but find no water. He ('Umar رضی ‌اللہ ‌عنہ ‌) told him not to say prayer. 'Ammar then said. Do you remember, O Commander of the Faithful, when I and you were in a military detachment and we had had a seminal emission and did not find water (for taking bath) and you did not say prayer, but as for myself I rolled in dust and said prayer, and (when it was mentioned before) the Apostle ( ‌صلی ‌اللہ ‌علیہ ‌وسلم ‌ ) said: It was enough for you to strike the ground with your hands and then blow (the dust) and then wipe your face and palms. Umar رضی ‌اللہ ‌عنہ said: 'Ammar, fear Allah. He said: If you so like, I would not narrate it. A hadith like this has been transmitted with the same chain of transmitters but for the words: 'Umar رضی ‌اللہ ‌عنہ said: We hold you responsible for what you claim.",The Book of Menstruation,Sahih Muslim,1,Sahih
821,Abdul-Rahman bin Abza mnated it on the authority of his father:,"A man came to Umar and said: I have had a seminal emission but I found no water, and the rest of the hadith is the same but with this addition: 'Amr said: 0 Commander of the Faithful, because of the right given to you by Allah over me, if you desire, I would not narrate this hadith to anyone.",The Book of Menstruation,Sahih Muslim,1,Sahih
822,"Umair, the freed slave of Ibn 'Abbas, reported:","I and 'Abd al-Rahmin b. Yasir, the freed slave of Maimuna, the wife of the Apostle (way peace be upon him). came to the house of Abu'l-Jahm b. al-Harith al-Simma Ansari and he said: The Messenger of Allah ( ‌صلی ‌اللہ ‌علیہ ‌وسلم ‌ ) came from the direction of Bi'r Jamal and a man met him; he saluted him but the Messenger of Allah ( ‌صلی ‌اللہ ‌علیہ ‌وسلم ‌ ) made no response, till he (the Holy Prophet) came to the wall, wiped his face and hands and then returned his salutations.",The Book of Menstruation,Sahih Muslim,1,Sahih
823,Ibn Umar reported:,"A person happened to pass by the Messenger of Allah ( ‌صلی ‌اللہ ‌علیہ ‌وسلم ‌) when he was making water and saluted him, but he did not respond to his salutation.",The Book of Menstruation,Sahih Muslim,1,Sahih
824,Hudhaifa reported:,"The Messenger of Allah ( ‌صلی ‌اللہ ‌علیہ ‌وسلم ‌ ) happened to meet him and he was (sexually) defiled, and he slipped away and took a bath and then came and said: I was (sexually) defiled. Upon this he (the Holy Prophet) remarked: A Muslim is never defiled.",The Book of Menstruation,Sahih Muslim,1,Sahih
