hadithNumber,englishNarrator,hadithEnglish,chapterEnglish,bookName,volume,status
4951,It has been narrated on the authority of Mughira who said:,I heard the Messenger of Allah (ﷺ) say: A group of people from my Umma will continue to be triumphant over the people until the Command of Allah overtakes them while they are still triumphant.,The Book of Government,Sahih Muslim,5,Sahih
4952,,"Al-Mughirah bin Shibah said: ""I heard the Messenger of Allah ﷺ say..."" a hadith like that of Marwan.",The Book of Government,Sahih Muslim,5,Sahih
4953,It has been narrated on the authority of Jabir bin Samura رضی ﷲ عنہ :,"The Prophet (ﷺ) said: This religion will continue to exist, and a group of people from the Muslims will continue to fight for its protection until the Hour is established.",The Book of Government,Sahih Muslim,5,Sahih
4954,It has been narrated on the authority of Jabir bin 'Abdullah who said:,I heard the Messenger of Allah (ﷺ) say: A group of people from my Umma will continue to fight In defense of truth and remain triumphant until the Day of judgment.,The Book of Government,Sahih Muslim,5,Sahih
4955,It his been narrated on the authority of Umair bin Umm Hani who said:,"I heard Mu'awiya رضی ‌اللہ ‌عنہ say (while delivering a sermon from the pulpit) that he heard the Messenger of Allah (ﷺ) say: A group of people from my Umma will continue to obey Allah's Command, and those who desert or oppose them shall not be able to do them any harm. They will be dominating the people until Allah's Command is executed (i. e. Resurrection is established).",The Book of Government,Sahih Muslim,5,Sahih
4956,Yazid bin al-Asamm said:,"He heard Mu'awiya bin Abu Sufyan رضی ‌اللہ ‌عنہ quote a tradition from the Prophet (ﷺ) which he related from the Prophet (ﷺ) and he did not hear him quote from the Prophet (ﷺ) any tradition other than this in the course of his sermon from the pulpit-that whom Allah wants to do a favor, He grants him an understanding of religion. A group of people from the Muslims will remain on the Right Path and continue until the Day of Judgment to triumph over those who oppose them.",The Book of Government,Sahih Muslim,5,Sahih
4957,It has been narrated on the authority of 'Abdul-Rahman bin Shamasa al- Mahri who said:,"I was in the company of Maslama bin Mukhallad, and 'Abdullah bin 'Amr bin 'As was with him. 'Abdullah رضی ‌اللہ ‌عنہ said: The Hour shall some only when the worst type of people are left on the earth. They will be worse than the people of pre-Islamic days. They will get whatever they ask of Allah. While we were yet sitting when 'Uqba bin 'Amir came, and Maslama said to him: 'Uqba, listen to what 'Abdullah says. 'Uqba said: He knows better; so far as I am concerned, I heard the Messenger of Allah (ﷺ) say: A group of people from my Umma will continue to fight in obedience to the Command of Allah, remaining dominant over their enemies. Those who will oppose them shall not do them any harm. They will remain ill this condition until the Hour overtakes them. (At this) 'Abdullah رضی ‌اللہ ‌عنہ said: Yes. Then Allah will raise a wild which will be fragrant like musk and whose touch will be like the touch of silk; (but) it will cause the death of all (faithful) persons, not leaving behind a single person with an iota of faith in his heart. Then only the worst of men will remain to be overwhelmed by the Hour.",The Book of Government,Sahih Muslim,5,Sahih
4958,It has been narrated by Sa'd bin Abu Waqqas رضی ‌اللہ ‌عنہ :,The Messenger of Allah (ﷺ) said: The people of the West will continue to triumphantly follow the truth until the Hour is established.,The Book of Government,Sahih Muslim,5,Sahih
4959,It has been narrated on the authority of Abu Huraira رضی اللہ عنہ :,"The Messenger of Allah ( ‌صلی ‌اللہ ‌علیہ ‌وسلم ‌) said: When you journey through a fertile land, you should (go slow and) give the camels a chance to graze in the land. When you travel In an arid (land) where there is scarcity of vegetation, you should quicken their pace (lest your camels grow feeble and emaciated for lack of fodder). When you halt for the night, avoid (pitching your tent on) the road, for it is the abode of noxious little animals at night.",The Book of Government,Sahih Muslim,5,Sahih
4960,It has been narrated (through another chain of transmitters) on the authority of Abu Huraira رضی اللہ عنہ :,"The Messenger of Allah ( ‌صلی ‌اللہ ‌علیہ ‌وسلم ‌ ) said: When you travel (through a land) where there is plenty of vegetation, you should (go slow and) give the camels a chance to enjoy the benefit of the earth. When you travel (through a land) where there is scarcity of vegetation, you should hasten with them (so that you may be able to cross that land while your animals ore still in a good condition of health). When you make a halt for the night, avoid (doing so on) the road, for the tracks are the pathways of wild beasts or the abode of noxious little animals.",The Book of Government,Sahih Muslim,5,Sahih
4961,On the authority of Abu Huraira رضی اللہ عنہ :,"The Prophet ( ‌صلی ‌اللہ ‌علیہ ‌وسلم ‌) said: Travelling is a tortuous experience. It deprives a person of his sleep. his food and drink. When one of you has accomplished his purpose, he should hasten his return to his family. He (Imam Malik) said: Yes.",The Book of Government,Sahih Muslim,5,Sahih
4962,It has been narrated on the authority of Anas bin Malik رضی اللہ عنہ :,The Messenger of Allah ( ‌صلی ‌اللہ ‌علیہ ‌وسلم ‌) would not come (back) to his family by night. He would come to them in the morning or in the evening.,The Book of Government,Sahih Muslim,5,Sahih
4963,"A similar report was narrated from Anas bin Malik رضی اللہ عنہ, from the prophet ﷺ but he said:",(He) would not enter (upon his household at night).,The Book of Government,Sahih Muslim,5,Sahih
4964,It has been narrated on the authority of Jabir bin 'Abdullah رضی اللہ عنہ who said:,"We accompanied the Messenger of Allah ( ‌صلی ‌اللہ ‌علیہ ‌وسلم ‌) on an expedition. When we came (back) to Medina and were going to enter our houses, he said: Wait and enter (your houses) in the later part of the evening so that a woman with disheveled hair may have used the comb, and a woman whose husband has been away from home may have removed the hair from her private parts.",The Book of Government,Sahih Muslim,5,Sahih
4965,It has been narrated on the authority of Jabir رضی اللہ عنہ :,The Messenger of Allah ( ‌صلی ‌اللہ ‌علیہ ‌وسلم ‌) said: If one of you comes (back from a journey) at night. he should not enter his house as a night visitor (but should wait) until a woman whose husband has been away from house has removed the hair from her private parts and a woman with disheveled hair has combed her hair.,The Book of Government,Sahih Muslim,5,Sahih
4966,,"Shubah narrated, sayyar narrated a similar hadith (as no. 4965) with this chain of narration.",The Book of Government,Sahih Muslim,5,Sahih
4967,It was narrated that Jabir رضی اللہ عنہ said:,The Messenger of Allah ( ‌صلی ‌اللہ ‌علیہ ‌وسلم ‌) forbade that a man who had long absent should come to his family like (an unexpected) night visitor.,The Book of Government,Sahih Muslim,5,Sahih
4968,,Shubah narrated it with this chain (a Hadith similar to no. 4967).,The Book of Government,Sahih Muslim,5,Sahih
4969,It was narrated that Jabir رضی اللہ عنہ said:,The Messenger of Allah ( ‌صلی ‌اللہ ‌علیہ ‌وسلم ‌) forbade that a man should come to his family like (an unexpected) night visitor doubting their fidelity and spying into their lapses.,The Book of Government,Sahih Muslim,5,Sahih
4970,Sufyan narrated with this chain of narration that 'Abdur Rahman said:,"I do not know if it in the hadith or not, meaning (the words) doubting their fidelity and spying into their lapses.",The Book of Government,Sahih Muslim,5,Sahih
4971,"It was narrated from Jabir رضی اللہ عنہ , from the prophet ﷺ, that:","The undesirability of coining to one's house like a night visitor, but does not contain the words: Doubting their fidelity or spying into their lapses.",The Book of Government,Sahih Muslim,5,Sahih
4972,Adi bin Hatim رضی اللہ عنہ reported:,"I said: Messenger of Allah, I set off trained dogs and they catch for me (the game) and I recite the name of Allah over it (I slaughter the game by reciting Bismillah-i-Allah-o-Akbar), whereupon he said: When you set off your trained dogs, if you recited the name of Allah (while setting them off), then eat (the game). I said: Even if they (the trained dogs) kill that (the game)? He (the Holy Prophet) said: Even if these kill, but (on the condition) that no other dog, which you did not set off (along with your dogs), participates (in catching the game). I said to him: I throw Mi'rad, a heavy featherless blunt arrow, for hunting and killing (the game). Thereupon he said: When you throw Mi'rad, and it pierces, then eat, but if it falls flatly (and beats the game to death), then do not eat that.","The Book of Hunting , Slaughter and what may be Eaten",Sahih Muslim,5,Sahih
4973,Adi bin Hatim رضی اللہ عنہ reported:,"I asked Allah's Messenger ( ‌صلی ‌اللہ ‌علیہ ‌وسلم ‌) saying: We are a people who hunt with these (trained) dogs, then (what should we do)? Thereupon he (the Holy Prophet ﷺ) said: When you set of your trained dogs having recited the name of Allah, then eat what these (hounds) have caught for you, even if it (the game) is killed, provided (the hunting dog) has not eaten (any part of the game). If it has eaten (the game), then you don't eat it as I fear that it might have caught for its own self. And do not eat it if other dogs have joined your trained dogs.","The Book of Hunting , Slaughter and what may be Eaten",Sahih Muslim,5,Sahih
4974,Adi bin Hatim رضی اللہ تعالیٰ عنہ reported:,"He asked the Messenger of Allah ( ‌صلی ‌اللہ ‌علیہ ‌وسلم ‌) about (hunting) with the help of an arrow having a stub end. He said: If it strikes (the game) with its point, then eat, but if it strikes flatly and it dies, that is Waqidh (beaten into death), do not eat that. I asked the Messenger of Allah ( ‌صلی ‌اللہ ‌علیہ ‌وسلم ‌) about (hunting with the help of) dogs, whereupon he said. When you send your dog (for hunting) reciting the name of Allah, then eat (the game), but if some part of it is eaten (by the dogs, then do not eat that, for it (your dog) has caught that (the-game) for itself. I (again) said: If I find along with my dog another dog, and do not know which of (the dogs) has caught (the game). then (what should I do)? Thereupon he ('Allah's Messenger) said: Then don't eat that, for you recited the name of Allah on your dog and not on the other one.","The Book of Hunting , Slaughter and what may be Eaten",Sahih Muslim,5,Sahih
4975,Adi bin Hatim رضی اللہ عنہ reported:,"I asked Allah's Messenger ( ‌صلی ‌اللہ ‌علیہ ‌وسلم ‌ ) about Mi'rad (i.e. hunting with the help of arrow having a stub end, and he stated the same (as we find in the previous hadith).","The Book of Hunting , Slaughter and what may be Eaten",Sahih Muslim,5,Sahih
