hadithNumber,englishNarrator,hadithEnglish,chapterEnglish,bookName,volume,status
5665,Narrated Ka`b bin 'Ujara رضی اللہ عنہ :,"The Prophet (ﷺ) passed by me while I was kindling a fire under a (cooking) pot. He said, ""Do the lice of your head trouble you?"" I said, ""Yes."" So he called a barber to shave my head and ordered me to make expiation for that.""",Patients,Sahih Bukhari,7,Sahih
5666,Narrated Al-Qasim bin Muhammad:,"`Aisha رضی اللہ عنہا , (complaining of headache) said, ""Oh, my head""! Allah's Messenger (ﷺ) said, ""I wish that had happened while I was still living, for then I would ask Allah's Forgiveness for you and invoke Allah for you."" Aisha رضی اللہ عنہا said, ""Wa thuklayah! By Allah, I think you want me to die; and If this should happen, you would spend the last part of the day sleeping with one of your wives!"" The Prophet (ﷺ) said, ""Nay, I should say, 'Oh my head!' I felt like sending for Abu Bakr رضی اللہ عنہ and his son, and appoint him as my successor lest some people claimed something or some others wished something, but then I said (to myself), 'Allah would not allow it to be otherwise, and the Muslims would prevent it to be otherwise"".",Patients,Sahih Bukhari,7,Sahih
5667,Narrated Ibn Mas`ud رضی اللہ عنہما :,"I visited the Prophet (ﷺ) while he was having a high fever. I touched him an said, ""You have a very high fever"" He said, ""Yes, as much fever as two me of you may have."" I said. ""you will have a double reward?"" He said, ""Yes No Muslim is afflicted with hurt caused by disease or some other inconvenience, but that Allah will remove his sins as a tree sheds its leaves.""",Patients,Sahih Bukhari,7,Sahih
5668,Narrated Sa`d:,"Allah's Messenger (ﷺ) came to visit me during my ailment which had been aggravated during Hajjat-al- Wada`. I said to him, ""You see how sick I am. I have much property but have no heir except my only daughter May I give two thirds of my property in charity?""! He said, ""No."" I said, ""Half of it?"" He said, ""No."" I said ""One third?"" He said, ""One third is too much, for to leave your heirs rich is better than to leave them poor, begging of others. Nothing you spend seeking Allah's pleasure but you shall get a reward for it, even for what you put in the mouth of your wife.""",Patients,Sahih Bukhari,7,Sahih
5669,Narrated Ibn `Abbas رضی اللہ عنہما :,"When Allah's Messenger (ﷺ) was on his death-bed and in the house there were some people among whom was `Umar bin Al-Khattab رضی اللہ عنہ , the Prophet (ﷺ) said, ""Come, let me write for you a statement after which you will not go astray."" `Umar رضی اللہ عنہ said, ""The Prophet (ﷺ) is seriously ill and you have the Qur'an; so the Book of Allah is enough for us."" The people present in the house differed and quarrelled. Some said ""Go near so that the Prophet (ﷺ) may write for you a statement after which you will not go astray,"" while the others said as `Umar رضی اللہ عنہ said. When they caused a hue and cry before the Prophet, Allah's Messenger (ﷺ) said, ""Go away!"" Narrated 'Ubaidullah: Ibn `Abbas رضی اللہ عنہما used to say, ""It was very unfortunate that Allah's Messenger (ﷺ) was prevented from writing that statement for them because of their disagreement and noise.""",Patients,Sahih Bukhari,7,Sahih
5670,Narrated As-Sa'ib رضی اللہ عنہ :,"My aunt took me to Allah's Messenger (ﷺ) and said, ""O Allah's Messenger (ﷺ)! My nephew is- ill."" The Prophet (ﷺ) touched my head with his hand and invoked Allah to bless me. He then performed ablution and I drank of the remaining water of his ablution and then stood behind his back and saw ""Khatam An- Nubuwwa"" (The Seal of Prophethood) between his shoulders like a button of a tent.",Patients,Sahih Bukhari,7,Sahih
5671,Narrated Anas bin Malik رضی اللہ عنہ :,"The Prophet (ﷺ) said, ""None of you should wish for death because of a calamity befalling him; but if he has to wish for death, he should say: ""O Allah! Keep me alive as long as life is better for me, and let me die if death is better for me.' """,Patients,Sahih Bukhari,7,Sahih
5672,Narrated Qais bin Abi Hazim:,"We went to pay a visit to Khabbab رضی اللہ عنہ (who was sick) and he had been branded (cauterized) at seven places in his body. He said, ""Our companions who died (during the lifetime of the Prophet) left (this world) without having their rewards reduced through enjoying the pleasures of this life, but we have got (so much) wealth that we find no way to spend It except on the construction of buildings Had the Prophet not forbidden us to wish for death, I would have wished for it.' We visited him for the second time while he was building a wall. He said, A Muslim is rewarded (in the Hereafter) for whatever he spends except for something that he spends on building.""",Patients,Sahih Bukhari,7,Sahih
5673,Narrated Abu Huraira رضی اللہ عنہ :,"I heard Allah's Messenger (ﷺ) saying, ""The good deeds of any person will not make him enter Paradise."" (i.e., None can enter Paradise through his good deeds.) They (the Prophet's companions) said, 'Not even you, O Allah's Messenger (ﷺ)?' He said, ""Not even myself, unless Allah bestows His favor and mercy on me."" So be moderate in your religious deeds and do the deeds that are within your ability: and none of you should wish for death, for if he is a good doer, he may increase his good deeds, and if he is an evil doer, he may repent to Allah.""",Patients,Sahih Bukhari,7,Sahih
5674,Narrated `Aisha رضی اللہ عنہا :,"I heard the Prophet (ﷺ) , who was resting against me, saying, ""O Allah! Excuse me and bestow Your Mercy on me and let me join with the highest companions (in Paradise)."" See Qur'an (4.69)",Patients,Sahih Bukhari,7,Sahih
5675,Narrated `Aisha رضی اللہ عنہا :,"Whenever Allah's Messenger (ﷺ) paid a visit to a patient, or a patient was brought to him, he used to invoke Allah, saying, ""Take away the disease, O the Lord of the people! Cure him as You are the One Who cures. There is no cure but Yours, a cure that leaves no disease."" Amr bin Abi Qais and Ibrahim bin Tahman from Mansur that Ibrahim and Abu Duha said: When any paitient was brought to him ﷺ. Or Abu Duha said: When he ﷺ visited any diseased.",Patients,Sahih Bukhari,7,Sahih
5676,Narrated Jabir bin `Abdullah رضی اللہ عنہما :,"The Prophet (ﷺ) came to me while I was ill. He performed ablution and threw the remaining water on me (or said, ""Pour it on him) "" When I came to my senses I said, ""O Allah's Messenger (ﷺ)! I have no son or father to be my heir, so how will be my inheritance?"" Then the Verse of inheritance was revealed.",Patients,Sahih Bukhari,7,Sahih
5677,Narrated `Aisha رضی اللہ عنہا :,"When Allah's Messenger (ﷺ) emigrated to Medina, Abu Bakr رضی اللہ عنہ and Bilal رضی اللہ عنہ had a fever. I entered upon them and said, ""O my father! How are you? O Bilal! How are you?"" Whenever Abu Bakr رضی اللہ عنہ got the fever he used to say, ""Everybody is staying alive with his people, yet death is nearer to him than his shoe laces."" And when fever deserted Bilal رضی اللہ عنہ , he would recite (two poetic verses): ""Would that I could stay overnight in a valley wherein I would be surrounded by Idhkhir and Jalil (two kinds of good smelling grass). Would that one day I could drink of the water of Majinna, and would that Shama and Tafil (two mountains at Mecca) would appear to me!"" I went to Allah's Messenger (ﷺ) and informed him about that. He said, ""O Allah! Make us love Medina as much or more than we love Mecca, and make it healthy, and bless its Sa and its Mudd, and take away its fever and put it in Al-Juhfa."" (See Hadith No 558) .",Patients,Sahih Bukhari,7,Sahih
5678,Narrated Abu Huraira رضی اللہ عنہ :,"The Prophet (ﷺ) said, ""There is no disease that Allah has created, except that He also has created its treatment.""",Medicine,Sahih Bukhari,7,Sahih
5679,Narrated Rubai bint Mu`adh bin Afra:,"We used to go for Military expeditions along with Allah's Messenger (ﷺ) and provide the people with water, serve them and bring the dead and the wounded back to Medina.",Medicine,Sahih Bukhari,7,Sahih
5680,Narrated Ibn `Abbas رضی اللہ عنہما :,"(The Prophet (ﷺ) said), ""Healing is in three things: A gulp of honey, cupping, and branding with fire (cauterizing)."" But I forbid my followers to use (cauterization) branding with fire."" He traced this Hadith back to the prophet ﷺ. Hadrat Ibn-e-Abbas رضی اللہ عنہما has reported honey and cupping from the prophet ﷺ.",Medicine,Sahih Bukhari,7,Sahih
5681,Narrated Ibn `Abbas رضی اللہ عنہما :,"The Prophet (ﷺ) said, ""Healing is in three things: cupping, a gulp of honey or cauterization, (branding with fire) but I forbid my followers to use cauterization (branding with fire).",Medicine,Sahih Bukhari,7,Sahih
5682,Narrated `Aisha رضی اللہ عنہا :,The Prophet (ﷺ) used to like sweet edible things and honey.,Medicine,Sahih Bukhari,7,Sahih
5683,Narrated Jabir bin `Abdullah رضی اللہ عنہما :,"I heard the Prophet (ﷺ) saying, ""If there is any healing in your medicines, then it is in cupping, a gulp of honey or branding with fire (cauterization) that suits the ailment, but I don't like to be (cauterized) branded with fire.""",Medicine,Sahih Bukhari,7,Sahih
5684,Narrated Abu Sa`id Al-Khudri رضی اللہ عنہ :,"A man came to the Prophet (ﷺ) and said, ""My brother has some Abdominal trouble."" The Prophet (ﷺ) said to him ""Let him drink honey."" The man came for the second time and the Prophet (ﷺ) said to him, 'Let him drink honey."" He came for the third time and the Prophet (ﷺ) said, ""Let him drink honey."" He returned again and said, ""I have done that ' The Prophet (ﷺ) then said, ""Allah has said the truth, but your brother's `Abdomen has told a lie. Let him drink honey."" So he made him drink honey and he was cured.",Medicine,Sahih Bukhari,7,Sahih
5685,Narrated Anas رضی اللہ عنہ :,"Some people were sick and they said, ""O Allah's Messenger (ﷺ)! Give us shelter and food. So when they became healthy they said, ""The weather of Medina is not suitable for us."" So he sent them to Al-Harra with some she-camels of his and said, ""Drink of their milk."" But when they became healthy, they killed the shepherd of the Prophet (ﷺ) and drove away his camels. The Prophet (ﷺ) sent some people in their pursuit. Then he got their hands and feet cut and their eyes were branded with heated pieces of iron. I saw one of them licking the earth with his tongue till he died. Salim said: I got this news that Hajjaj submitted to Hadrat Anas رضی اللہ عنہ: Tell me the severest punishment the prophet ﷺ meted out to someone; he, thereupon, narrated this Hadith. This Hadith reached Hadith Basri and he said: Would that this Hadith had not been narrated.",Medicine,Sahih Bukhari,7,Sahih
5686,Narrated Anas رضی اللہ عنہ :,"The climate of Medina did not suit some people, so the Prophet (ﷺ) ordered them to follow his shepherd, i.e. his camels, and drink their milk and urine (as a medicine). So they followed the shepherd that is the camels and drank their milk and urine till their bodies became healthy. Then they killed the shepherd and drove away the camels. When the news reached the Prophet (ﷺ) he sent some people in their pursuit. When they were brought, he cut their hands and feet and their eyes were branded with heated pieces of iron. Qatadah says that Muhammad bin Sireen told him that it happend prior to the command of prescribed punishment.",Medicine,Sahih Bukhari,7,Sahih
5687,Narrated Khalid bin Sa`d:,"We went out and Ghalib bin Abjar رضی اللہ عنہ was accompanying us. He fell ill on the way and when we arrived at Medina he was still sick. Ibn Abi 'Atiq came to visit him and said to us, ""Treat him with black cumin. Take five or seven seeds and crush them (mix the powder with oil) and drop the resulting mixture into both nostrils, for `Aisha رضی اللہ عنہا has narrated to me that she heard the Prophet (ﷺ) saying, 'This black cumin is healing for all diseases except As-Sam.' Aisha رضی اللہ عنہا said, 'What is As-Sam?' He said, 'Death.""",Medicine,Sahih Bukhari,7,Sahih
5688,Narrated Abu Huraira رضی اللہ عنہ :,"I heard Allah's Messenger (ﷺ) saying, ""There is healing in black cumin for all diseases except death."" Ibn-e-Shihab narrates: Saam means death, and black seed means Nigella seed.",Medicine,Sahih Bukhari,7,Sahih
5689,Narrated 'Urwa:,"Aisha رضی اللہ عنہا used to recommend at-Talbina for the sick and for such a person as grieved over a dead person. She used to say, ""I heard Allah's Messenger (ﷺ) saying, 'at-Talbina gives rest to the heart of the patient and makes it active and relieves some of his sorrow and grief.'""",Medicine,Sahih Bukhari,7,Sahih
