hadithNumber,englishNarrator,hadithEnglish,chapterEnglish,bookName,volume,status
539,Narrated Abu Dhar Al-Ghifari رضی اللہ عنہ :,"We were with the Prophet (ﷺ) on a journey and the Mu'adh-dhin (call maker for the prayer) wanted to pronounce the Adhan (call) for the Zuhr prayer. The Prophet (ﷺ) said, 'Let it become cooler."" He again (after a while) wanted to pronounce the Adhan but the Prophet (ﷺ) said to him, ""Let it become cooler till we see the shadows of hillocks."" The Prophet (ﷺ) added, ""The severity of heat is from the raging of the Hell-fire, and in very hot weather pray (Zuhr) when it becomes cooler.""",Times of the Prayers,Sahih Bukhari,1,Sahih
540,Narrated Anas bin Malik رضی اللہ عنہ :,"Allah's Messenger (ﷺ) came out as the sun declined at midday and offered the Zuhr prayer. He then stood on the pulpit and spoke about the Hour (Day of Judgment) and said that in it there would be tremendous things. He then said, ""Whoever likes to ask me about anything he can do so and I shall reply as long as I am at this place of mine. Most of the people wept and the Prophet (ﷺ) said repeatedly, ""Ask me."" `Abdullah bin Hudhafa As-Sahmi stood up and said, ""Who is my father?"" The Prophet (ﷺ) said, ""Your father is Hudhafa."" The Prophet (ﷺ) repeatedly said, ""Ask me."" Then `Umar knelt before him and said, ""We are pleased with Allah as our Lord, Islam as our religion, and Muhammad as our Prophet."" The Prophet then became quiet and said, ""Paradise and Hell-fire were displayed in front of me on this wall just now and I have never seen a better thing (than the former) and a worse thing (than the latter).",Times of the Prayers,Sahih Bukhari,1,Sahih
541,Narrated Abu Barza رضی اللہ عنہ :,"""The Prophet (ﷺ) used to offer the Fajr (prayer) when one could recognize the person sitting by him (after the prayer) and he used to recite between 60 to 100 Ayat (verses) of the Qur'an. He used to offer the Zuhr prayer as soon as the sun declined (at noon) and the `Asr at a time when a man might go and return from the farthest place in Medina and find the sun still hot. (The sub-narrator forgot what was said about the Maghrib). He did not mind delaying the `Isha prayer to one third of the night or the middle of the night.""",Times of the Prayers,Sahih Bukhari,1,Sahih
542,Narrated Anas bin Malik رضی اللہ عنہ :,When we offered the Zuhr prayers behind Allah's Messenger (ﷺ) we used to prostrate on our clothes to protect ourselves from the heat.,Times of the Prayers,Sahih Bukhari,1,Sahih
543,Narrated Ibn `Abbas رضی اللہ عنہما :,"""The Prophet (ﷺ) prayed eight rak`at for the Zuhr and `Asr, and seven for the Maghrib and `Isha prayers in Medina."" Ayyub said, ""Perhaps those were rainy nights."" He (Jabir bin Zaid) said: ""May be.""",Times of the Prayers,Sahih Bukhari,1,Sahih
544,Narrated Aisha رضی اللہ عنہا :,Allah's Messenger (ﷺ) used to offer the `Asr prayer when the sunshine had not disappeared from my chamber.,Times of the Prayers,Sahih Bukhari,1,Sahih
545,Narrated `Aisha رضی اللہ عنہا :,Allah's Messenger (ﷺ) used to offer the `Asr prayers at a time when the sunshine was still inside my chamber and no shadow had yet appeared in it.,Times of the Prayers,Sahih Bukhari,1,Sahih
546,Narrated Aisha رضی اللہ عنہا :,The Prophet (ﷺ) used to pray the `Asr prayers at a time when the sunshine was still inside my chamber and no shadow had yet appeared in it.,Times of the Prayers,Sahih Bukhari,1,Sahih
547,Narrated Saiyar bin Salama:,"I along with my father went to Abu- Barza Al-Aslami رضی اللہ عنہ and my father asked him, ""How Allah's Messenger (ﷺ) used to offer the five compulsory congregational prayers?"" Abu- Barza said, ""The Prophet (ﷺ) used to pray the Zuhr prayer which you (people) call the first one at midday when the sun had just declined The `Asr prayer at a time when after the prayer, a man could go to the house at the farthest place in Medina (and arrive) while the sun was still hot. (I forgot about the Maghrib prayer). The Prophet (ﷺ) Loved to delay the `Isha which you call Al- `Atama and he disliked sleeping before it and speaking after it. After the Fajr prayer he used to leave when a man could recognize the one sitting beside him and he used to recite between 60 to 100 Ayat (in the Fajr prayer) .",Times of the Prayers,Sahih Bukhari,1,Sahih
548,Narrated Anas bin Malik رضی اللہ عنہ :,"We used to pray the `Asr prayer and after that if someone happened to go to the tribe of Bani `Amr bin `Auf, he would find them still praying the `Asr (prayer).",Times of the Prayers,Sahih Bukhari,1,Sahih
549,Narrated Abu Bakr bin `Uthman bin Sahl bin Hunaif that he heard Abu Umama saying:,"We prayed the Zuhr prayer with `Umar bin `Abdul `Aziz and then went to Anas bin Malik رضی اللہ عنہ and found him offering the `Asr prayer. I asked him, ""O uncle! Which prayer have you offered?"" He said 'The `Asr and this is (the time of) the prayer of Allah s Apostle which we used to pray with him.""",Times of the Prayers,Sahih Bukhari,1,Sahih
550,Narrated Anas bin Malik رضی اللہ عنہ :,"Allah's Messenger (ﷺ) used to offer the `Asr prayer at a time when the sun was still hot and high and if a person went to Al-`Awali (a place) of Medina, he would reach there when the sun was still high. Some of Al-`Awali of Medina were about four miles or so from the town.",Times of the Prayers,Sahih Bukhari,1,Sahih
551,Narrated Anas bin Malik رضی اللہ عنہ :,We used to pray the `Asr and after that if one of US went to Quba' he would arrive there while the sun was still high.,Times of the Prayers,Sahih Bukhari,1,Sahih
552,Narrated Ibn `Umar رضی اللہ عنہما :,"Allah's Messenger (ﷺ) said, ""Whoever misses the `Asr prayer (intentionally) then it is as if he lost his family and property.""",Times of the Prayers,Sahih Bukhari,1,Sahih
553,Narrated Abu Al-Malih:,"We were with Buraida رضی اللہ عنہ in a battle on a cloudy day and he said, ""Offer the `Asr prayer early as the Prophet said, ""Whoever leaves the `Asr prayer, all his (good) deeds will be annulled.""",Times of the Prayers,Sahih Bukhari,1,Sahih
554,Narrated Jarir:,"""We were with the Prophet (ﷺ) and he looked at the moon--full-moon--and said, 'Certainly you will see your Lord as you see this moon and you will have no trouble in seeing Him. So if you can avoid missing (through sleep or business, etc.) a prayer before the sunrise (Fajr) and a prayer before sunset (`Asr), you must do so.' He then recited Allah's Statement: ___And celebrate the praises Of your Lord before the rising of the sun and before (its) setting."" (50.39) Isma`il said, ""Offer those prayers and do not miss them.""",Times of the Prayers,Sahih Bukhari,1,Sahih
555,Narrated Abu Huraira رضی اللہ عنہ :,"Allah's Messenger (ﷺ) said, ""Angels come to you in succession by night and day and all of them get together at the time of the Fajr and `Asr prayers. Those who have passed the night with you (or stayed with you) ascend (to the Heaven) and Allah asks them, though He knows everything about you, well, ""In what state did you leave my slaves?"" The angels reply: ""When we left them they were praying and when we reached them, they were praying.""",Times of the Prayers,Sahih Bukhari,1,Sahih
556,Narrated Abu Huraira رضی اللہ عنہ :,"Allah's Messenger (ﷺ) said, ""If anyone of you can get one rak`a of the `Asr prayer before sunset, he should complete his prayer. If any of you can get one rak`a of the Fajr prayer before sunrise, he should complete his prayer.""",Times of the Prayers,Sahih Bukhari,1,Sahih
557,Narrated Salim bin `Abdullah:,"My father said, ""I heard Allah's Messenger (ﷺ) saying, 'The period of your stay as compared to the previous nations is like the period equal to the time between the `Asr prayer and sunset. The people of the Torah were given the Torah and they acted (upon it) till midday then they were exhausted and were given one Qirat (of gold) each. And then the people of the Gospel were given the Gospel and they acted (upon it) till the `Asr prayer then they were exhausted and were! given one Qirat each. And then we were given the Qur'an and we acted (upon it) till sunset and we were given two Qirats each. On that the people of both the scriptures said, 'O our Lord! You have given them two Qirats and given us one Qirat, though we have worked more than they.' Allah said, 'Have I usurped some of your right?' They said, 'No.' Allah said: ""That is my blessing I bestow upon whomsoever I wish.""",Times of the Prayers,Sahih Bukhari,1,Sahih
558,Narrated Abu Musa رضی اللہ عنہ :,"The Prophet (ﷺ) said, ""The example of Muslims, Jews and Christians is like the example of a man who employed laborers to work for him from morning till night. They worked till midday and they said, 'We are not in need of your reward.' So the man employed another batch and said to them, 'Complete the rest of the day and yours will be the wages I had fixed (for the first batch). They worked until the time of the `Asr prayer and said, 'Whatever we have done is for you.' He employed another batch. They worked for the rest of the day till sunset, and they received the wages of the two former batches.""",Times of the Prayers,Sahih Bukhari,1,Sahih
559,Narrated Rafi` bin Khadij رضی اللہ عنہ :,We used to offer the Maghrib prayer with the Prophet (ﷺ) and after finishing the prayer one of us may go away and could still see as Par as the spots where one's arrow might reach when shot by a bow.,Times of the Prayers,Sahih Bukhari,1,Sahih
560,Narrated Muhammad bin Amr bin Hasan bin Ali:,"The era of the Hajjaj came (and he used to lead the prayer late, so) we asked Hazrat Jabir bin `Abdullah about it, and he said: ""The Prophet (ﷺ) used to pray the Zuhr at midday, and the `Asr at a time when the sun was still bright, the Maghrib after sunset (at its stated time) and the `Isha at a variable time. Whenever he saw the people assembled (for `Isha' prayer) he would pray earlier and if the people delayed, he would delay the prayer. And they or the Prophet (ﷺ) used to offer the Fajr Prayers when it still dark.""",Times of the Prayers,Sahih Bukhari,1,Sahih
561,Narrated Salama رضی اللہ عنہ :,We used to pray the Maghrib prayer with the Prophet (ﷺ) when the sun disappeared from the horizon.,Times of the Prayers,Sahih Bukhari,1,Sahih
562,Narrated Ibn `Abbas رضی اللہ عنہما :,The Prophet (ﷺ) prayed seven rak`at together and eight rak`at together.,Times of the Prayers,Sahih Bukhari,1,Sahih
563,Narrated `Abdullah Al-Muzani رضی اللہ عنہ :,"The Prophet (ﷺ) said, ""Do not be influenced by bedouins regarding the name of your Maghrib prayer which is called `Isha' by them.""",Times of the Prayers,Sahih Bukhari,1,Sahih
