hadithNumber,englishNarrator,hadithEnglish,chapterEnglish,bookName,volume,status
1299,Narrated `Aisha رضی اللہ عنہا :,"When the Prophet (ﷺ) got the news of the death of Ibn Haritha, Ja`far and Ibn Rawaha رضی اللہ عنہم he sat down and looked sad and I was looking at him through the chink of the door. A man came and told him about the crying of the women of Ja`far رضی اللہ عنہ . The Prophet (ﷺ) ordered him to forbid them. The man went and came back saying that he had told them but they did not listen to him. The Prophet (ﷺ) said, ""Forbid them."" So again he went and came back for the third time and said, ""O Allah's Messenger (ﷺ)! By Allah, they did not listen to us at all."" (`Aisha رضی اللہ عنہا added): Allah's Messenger (ﷺ) ordered him to go and put dust in their mouths. I said, (to that man) ""May Allah stick your nose in the dust (i.e. humiliate you)! You could neither (persuade the women to) fulfill the order of Allah's Messenger (ﷺ) nor did you relieve Allah's Messenger (ﷺ) from fatigue. """,Funerals (Al-Janaa'iz),Sahih Bukhari,2,Sahih
1300,Narrated Anas رضی اللہ عنہ :,"When the reciters of Qur'an were martyred, Allah's Messenger (ﷺ) recited Qunut for one month and I never saw him (i.e. Allah's Messenger (ﷺ)) so sad as he was on that day.",Funerals (Al-Janaa'iz),Sahih Bukhari,2,Sahih
1301,Narrated Anas bin Malik رضی اللہ عنہ :,"One of the sons of Abu Talha رضی اللہ عنہ became sick and died and Abu Talha رضی اللہ عنہ at that time was not at home. When his wife saw that he was dead, she prepared him (washed and shrouded him) and placed him somewhere in the house. When Abu Talha رضی اللہ عنہ came, he asked, ""How is the boy?"" She said, ""The child is quiet and I hope he is in peace."" Abu Talha thought that she had spoken the truth. Abu Talha رضی اللہ عنہ passed the night and in the morning took a bath and when he intended to go out, she told him that his son had died, Abu Talha offered the (morning) prayer with the Prophet (ﷺ) and informed the Prophet (ﷺ) of what happened to them. Allah's Messenger (ﷺ) said, ""May Allah bless you concerning your night. (That is, may Allah bless you with good offspring)."" Sufyan said, ""One of the Ansar said, 'They (i.e. Abu Talha and his wife) had nine sons and all of them became reciters of the Qur'an (by heart).' """,Funerals (Al-Janaa'iz),Sahih Bukhari,2,Sahih
1302,Narrated Anas رضی اللہ عنہ :,"The Prophet (ﷺ) said, ""The real patience is at the first stroke of a calamity.""",Funerals (Al-Janaa'iz),Sahih Bukhari,2,Sahih
1303,Narrated Anas bin Malik رضی اللہ عنہ :,"We went with Allah's Messenger (ﷺ) to the blacksmith Abu Saif, and he was the husband of the wet-nurse of Ibrahim (the son of the Prophet). Allah's Messenger (ﷺ) took Ibrahim and kissed him and smelled him and later we entered Abu Saif's house and at that time Ibrahim was in his last breaths, and the eyes of Allah's Messenger (ﷺ) started shedding tears. `Abdur Rahman bin `Auf said, ""O Allah's Apostle, even you are weeping!"" He said, ""O Ibn `Auf, this is mercy."" Then he wept more and said, ""The eyes are shedding tears and the heart is grieved, and we will not say except what pleases our Lord, O Ibrahim ! Indeed we are grieved by your separation.""The same hadith was narrated by Musa bin Ismail on the authority of Sulaiman bin Mughira, on the authority of Thabit, and on the authority of Anas رضی اللہ عنہ from the Prophet (ﷺ).",Funerals (Al-Janaa'iz),Sahih Bukhari,2,Sahih
1304,Narrated `Abdullah bin `Umar رضی اللہ عنہما :,"Sa`d bin 'Ubada رضی اللہ عنہ became sick and the Prophet (ﷺ) along with `Abdur Rahman bin `Auf, Sa`d bin Abi Waqqas and `Abdullah bin Mas`ud رضی اللہ عنہ visited him to inquire about his health. When he came to him, he found him surrounded by his household and he asked, ""Has he died?"" They said, ""No, O Allah's Apostle."" The Prophet (ﷺ) wept and when the people saw the weeping of Allah's Messenger (ﷺ) (p.b.u.h) they all wept. He said, ""Will you listen? Allah does not punish for shedding tears, nor for the grief of the heart but he punishes or bestows His Mercy because of this."" He pointed to his tongue and added, ""The deceased is punished for the wailing of his relatives over him."" `Umar رضی اللہ عنہ used to beat with a stick and throw stones and put dust over the faces (of those who used to wail over the dead).",Funerals (Al-Janaa'iz),Sahih Bukhari,2,Sahih
1305,Narrated Aisha رضی اللہ عنہا :,"When the news of the martyrdom of Zaid bin Haritha, Ja`far and `Abdullah bin Rawaha رضی اللہ عنہم came, the Prophet sat down looking sad, and I was looking through the chink of the door. A man came and said, ""O Allah's Messenger (ﷺ)! The women of Ja`far,"" and then he mentioned their crying . The Prophet (ﷺ) ordered him to stop them from crying. The man went and came back and said, ""I tried to stop them but they disobeyed."" The Prophet (ﷺ) ordered him for the second time to forbid them. He went again and came back and said, ""They did not listen to me, (or ""us"": the sub-narrator Muhammad bin Haushab is in doubt as to which is right). "" (`Aisha رضی اللہ عنہا added: The Prophet (ﷺ) said, ""Put dust in their mouths."" I said (to that man), ""May Allah stick your nose in the dust (i.e. humiliate you)."" By Allah, you could not (stop the women from crying) to fulfill the order, besides you did not relieve Allah's Apostle (ﷺ) from fatigue.""",Funerals (Al-Janaa'iz),Sahih Bukhari,2,Sahih
1306,Narrated Um 'Atiyya رضی اللہ عنہا :,"At the time of giving the pledge of allegiance to the Prophet (ﷺ) one of the conditions was that we would not wail, but it was not fulfilled except by five women and they are Um Sulaim, Um Al-`Ala', the daughter of Abi Sabra (the wife of Mu`adh), and two other women; or the daughter of Abi Sabra and the wife of Mu`adh and another woman.",Funerals (Al-Janaa'iz),Sahih Bukhari,2,Sahih
1307,Narrated 'Amir bin Rabi`a رضی اللہ عنہ :,"The Prophet (ﷺ) said, ""Whenever you see a funeral procession, stand up till the procession goes ahead of you."" Al-Humaidi added, ""Till the coffin leaves you behind or is put down.""",Funerals (Al-Janaa'iz),Sahih Bukhari,2,Sahih
1308,Narrated 'Amir bin Rabi`a رضی اللہ عنہ :,"The Prophet (ﷺ) said, ""If any one of you see a funeral procession and he is not going along with it, then he should stand and remain standing till he gets behind it, or it leaves him behind, or the coffin is put down before it goes ahead of him . """,Funerals (Al-Janaa'iz),Sahih Bukhari,2,Sahih
1309,Narrated Sa`id Al-Maqburi:,"That his father said, ""While we were accompanying a funeral procession, Abu Huraira رضی اللہ عنہ got hold of the hand of Marwan and they sat down before the coffin was put down. Then Abu Sa`id came and took hold of Marwan's hand and said, ""Get up. By Allah, no doubt this (i.e. Abu Huraira رضی اللہ عنہ) knows that the Prophet forbade us to do that."" Abu Huraira رضی اللہ عنہ said, ""He (Abu Sa`id رضی اللہ عنہ) has spoken the truth.""",Funerals (Al-Janaa'iz),Sahih Bukhari,2,Sahih
1310,Narrated Abu Sa`id Al-Khudri رضی اللہ عنہ :,"The Prophet (ﷺ) said, ""When you see a funeral procession, you should stand up, and whoever accompanies it should not sit till the coffin is put down.""",Funerals (Al-Janaa'iz),Sahih Bukhari,2,Sahih
1311,Narrated Jabir bin `Abdullah:,"A funeral procession passed in front of us and the Prophet (ﷺ) stood up and we too stood up. We said, 'O Allah's Messenger (ﷺ)! This is the funeral procession of a Jew."" He said, ""Whenever you see a funeral procession, you should stand up.""",Funerals (Al-Janaa'iz),Sahih Bukhari,2,Sahih
"1312, 1313",Narrated `Abdur Rahman bin Abi Laila:,"Sahl bin Hunaif and Qais bin Sa`d رضی اللہ عنہما were sitting in the city of Al-Qadisiya. A funeral procession passed in front of them and they stood up. They were told that funeral procession was of one of the inhabitants of the land i.e. of a non-believer, under the protection of Muslims. They said, ""A funeral procession passed in front of the Prophet (ﷺ) and he stood up. When he was told that it was the coffin of a Jew, he said, ""Is it not a living being (soul)?"" Hadrat Ibn-e Abu Laila reports: I was in the company of Hadrat Qais and Hadrat Sehl رضی اللہ عنہما . Both of them said: We were with the prophet ﷺ. Abu Laila, with an other authority, reports: Hadrat Abu Masoud and Hadrat Abu Qais رضی اللہ عنہما would get up for a funeral.",Funerals (Al-Janaa'iz),Sahih Bukhari,2,Sahih
1314,Narrated Abu Sa`id Al-Khudri رضی اللہ عنہ :,"Allah's Messenger (ﷺ) said, When the funeral is ready and the men carry it on their shoulders, if the deceased was righteous it will say, 'Present me (hurriedly),' and if he was not righteous, it will say, 'Woe to it (me)! Where are they taking it (me)?' Its voice is heard by everything except man and if he heard it he would fall unconscious.""",Funerals (Al-Janaa'iz),Sahih Bukhari,2,Sahih
1315,Narrated Abu Huraira رضی اللہ عنہ :,"The Prophet (ﷺ) said, ""Hurry up with the dead body for if it was righteous, you are forwarding it to welfare; and if it was otherwise, then you are putting off an evil thing down your necks.""",Funerals (Al-Janaa'iz),Sahih Bukhari,2,Sahih
1316,Narrated Abu Sa`id Al-Khudri رضی اللہ عنہ :,"The Prophet (ﷺ) said, ""When a funeral is ready and the men carry the deceased on their necks (shoulders), if it was pious then it will say, 'Present me quickly', and if it was not pious, then it will say, 'Woe to it (me), where are they taking it (me)?' And its voice is heard by everything except mankind and if he heard it he would fall unconscious.""",Funerals (Al-Janaa'iz),Sahih Bukhari,2,Sahih
1317,Narrated Jabir bin `Abdullah رضی اللہ عنہما :,Allah's Messenger (ﷺ) offered the funeral prayer for An-Najashi and I was in the second or third row.,Funerals (Al-Janaa'iz),Sahih Bukhari,2,Sahih
1318,Narrated Abu Huraira رضی اللہ عنہ :,The Prophet (ﷺ) informed his companions about the death of An-Najashi and then he went ahead (to lead the prayer) and the people lined up behind him in rows and he said four Takbir.,Funerals (Al-Janaa'iz),Sahih Bukhari,2,Sahih
1319,Narrated Ash Shu`bi:,"""I was informed by a man who had seen the Prophet (ﷺ) going to a grave that was separate from the other graves and he aligned the people in rows and said four Takbir."" I said, ""O Abu `Amr! who narrated (that) to you""? He said, ""Ibn `Abbas رضی اللہ عنہما . """,Funerals (Al-Janaa'iz),Sahih Bukhari,2,Sahih
1320,Narrated Jabir bin `Abdullah رضی اللہ عنہما :,"The Prophet (ﷺ) said, ""Today a pious man from Ethiopia (i.e. An Najashi) has expired, come on to offer the funeral prayer."" (Jabir رضی اللہ عنہ said): We lined up in rows and after that the Prophet (ﷺ) led the prayer and we were in rows. Jabir رضی اللہ عنہ added, I was in the second row.""",Funerals (Al-Janaa'iz),Sahih Bukhari,2,Sahih
1321,Narrated Ibn `Abbas:,"Allah's Messenger (ﷺ) passed by a grave of a deceased who had been buried at night. He said, ""When was this (deceased) buried?"" The people said, ""Yesterday."" He said, ""Why did you not inform me?"" They said, ""We buried him when it was dark and so we disliked to wake you up."" He stood up and we lined up behind him. (Ibn `Abbas said): I was one of them, and the Prophet (ﷺ) offered the funeral prayer.",Funerals (Al-Janaa'iz),Sahih Bukhari,2,Sahih
1322,Narrated Ash-Shu`bi:,"""Somebody who passed along with your Prophet (ﷺ) by a grave that was separate from the other graves informed me (saying), ""The Prophet (ﷺ) led us (in the prayer) and we aligned behind him."" We said, ""O Abu `Amr! Who told you this narration?"" He replied, ""Ibn `Abbas رضی اللہ عنہما .""",Funerals (Al-Janaa'iz),Sahih Bukhari,2,Sahih
"1323, 1324",Narrated Abu Huraira رضی اللہ عنہ :,"""Whoever accompanies the funeral procession will have a reward equal to one Qirat."" Ibn `Umar رضی اللہ عنہما said, ""Abu Huraira رضی اللہ عنہ talks of a too enormous reward."" Aisha رضی اللہ عنہا attested Abu Huraira's narration and said, ""I heard Allah's Messenger (ﷺ) saying like that."" Ibn `Umar رضی اللہ عنہما said, ""We have lost numerous Qirats.""",Funerals (Al-Janaa'iz),Sahih Bukhari,2,Sahih
1325,Narrated Abu Huraira رضی اللہ عنہ :,"That Allah's Messenger (ﷺ) said, ""Whoever attends the funeral procession till he offers the funeral prayer for it, will get a reward equal to one Qirat, and whoever accompanies it till burial, will get a reward equal to two Qirats."" It was asked, ""What are two Qirats?"" He replied, ""Like two huge mountains.""",Funerals (Al-Janaa'iz),Sahih Bukhari,2,Sahih
