hadithNumber,englishNarrator,hadithEnglish,chapterEnglish,bookName,volume,status
406,Narrated `Abdullah bin `Umar رضی اللہ عنہما :,"Allah's Messenger (ﷺ) saw sputum on the wall of the mosque in the direction of the Qibla and scraped it off. He faced the people and said, ""Whenever any one of you is praying, he should not spit in front of him because in the prayer Allah is in front of him.""",Prayers (Salat),Sahih Bukhari,1,Sahih
407,"Narrated `Aisha رضی اللہ عنہا , (the mother of faithful believers):","Allah's Messenger (ﷺ) saw some nasal secretions, expectoration or sputum on the wall of the mosque in the direction of the Qibla and scraped it off.",Prayers (Salat),Sahih Bukhari,1,Sahih
"408, 409",Narrated Abu Huraira and Abu Sa`id رضی اللہ عنہما :,"Allah's Messenger (ﷺ) saw some expectoration on the wall of the mosque; he took gravel and scraped it off and said, ""If anyone of you wanted to spit he should neither spit in front of him nor on his right but he could spit either on his left or under his left foot.""",Prayers (Salat),Sahih Bukhari,1,Sahih
"410, 411",Narrated Abu Huraira and Abu Sa`id رضی اللہ عنہما :,"Allah's Messenger (ﷺ) saw some expectoration on the wall of the mosque; he took gravel and scraped it off and said, ""If anyone of you wanted to spit, he should neither spit in front of him nor on his right but could spit either on his left or under his left foot.""",Prayers (Salat),Sahih Bukhari,1,Sahih
412,Narrated Anas:,"The Prophet (ﷺ) said, ""None of you should spit in front or on his right but he could spit either on his left or under his foot.""",Prayers (Salat),Sahih Bukhari,1,Sahih
413,Narrated Anas bin Malik رضی اللہ عنہ :,"The Prophet (ﷺ) said, ""A faithful believer while in prayer is speaking in private to his Lord, so he should neither spit in front of him nor to his right side but he could spit either on his left or under his foot.""",Prayers (Salat),Sahih Bukhari,1,Sahih
414,Narrated Abu Sa`id:,"The Prophet (ﷺ) saw sputum on (the wall of) the mosque in the direction of the Qibla and scraped it off with gravel. Then he forbade Spitting in front or on the right, but allowed it on one's left or under one's left foot.",Prayers (Salat),Sahih Bukhari,1,Sahih
415,Narrated Anas bin Malik رضی اللہ عنہ :,"The Prophet (ﷺ) said, ""Spitting in the mosque is a sin and its expiation is to bury it.""",Prayers (Salat),Sahih Bukhari,1,Sahih
416,Narrated Abu Huraira رضی اللہ عنہ :,"Prophet said, ""If anyone of you stands for prayer, he should not spit in front of him because in prayer he is speaking in private to Allah and he should not spit on his right as there is an angel, but he can spit either on his left or under his left foot and bury it (i.e. expectoration).",Prayers (Salat),Sahih Bukhari,1,Sahih
417,Narrated Anas:,"The Prophet (ﷺ) saw expectoration (on the wall of the mosque) in the direction of the Qibla and scraped it off with his hand. It seemed that he disliked it and the sign of disgust was apparent from his face. He said, ""If anyone of you stands for the prayer, he is speaking in private to his Lord, (or) his Lord is between him and his Qibla, therefore he should not spit towards his Qibla, but he could spit either on his left or under his foot."" Then he took the corner of his sheet and spat in it, folded it and said, ""Or do this.""",Prayers (Salat),Sahih Bukhari,1,Sahih
418,Narrated Abu Huraira رضی اللہ عنہ :,"Allah's Messenger (ﷺ) said, ""Do you consider or see that my face is towards the Qibla? By Allah, neither your submissiveness nor your bowing is hidden from me, surely I see you from my back.""",Prayers (Salat),Sahih Bukhari,1,Sahih
419,Narrated Anas bin Malik رضی اللہ عنہ :,"The Prophet (ﷺ) led us in a prayer and then got up on the pulpit and said, ""In your prayer and bowing, I certainly see you from my back as I see you (while looking at you.)""",Prayers (Salat),Sahih Bukhari,1,Sahih
420,Narrated `Abdullah bin `Umar رضی اللہ عنہما :,Allah's Messenger (ﷺ) ordered for a horse race; the trained horses were to run from a place called Al-Hafya' to Thaniyat Al-Wada` and the horses which were not trained were to run from Al-Thaniya to the Masjid (mosque of) Bani Zuraiq. The sub narrator added: Ibn `Umar was one of those who took part in the race.,Prayers (Salat),Sahih Bukhari,1,Sahih
421,Narrated Anas رضی اللہ عنہ :,"Some goods came to Allah's Messenger (ﷺ) from Bahrain. The Prophet (ﷺ) ordered the people to spread them in the mosque --it was the biggest amount of goods Allah's Messenger (ﷺ) had ever received. He left for prayer and did not even look at it. After finishing the prayer, he sat by those goods and gave from those to everybody he saw. Al-`Abbas came to him and said, ""O Allah's Messenger (ﷺ)! give me (something) too, because I gave ransom for myself and `Aqil"". Allah's Messenger (ﷺ) told him to take. So he stuffed his garment with it and tried to carry it away but he failed to do so. He said, ""O Allah's Messenger (ﷺ)! Order someone to help me in lifting it."" The Prophet (ﷺ) refused. He then said to the Prophet: Will you please help me to lift it?"" Allah's Messenger (ﷺ) refused. Then Al-`Abbas threw some of it and tried to lift it (but failed). He again said, ""O Allah's Messenger (ﷺ) Order someone to help me to lift it."" He refused. Al-`Abbas then said to the Prophet: ""Will you please help me to lift it?"" He again refused. Then Al-`Abbas threw some of it, and lifted it on his shoulders and went away. Allah's Messenger (ﷺ) kept on watching him till he disappeared from his sight and was astonished at his greediness. Allah's Messenger (ﷺ) did not get up till the last coin was distributed.",Prayers (Salat),Sahih Bukhari,1,Sahih
422,Narrated Anas رضی اللہ عنہ :,"I found the Prophet (ﷺ) in the mosque along with some people. He said to me, ""Did Abu Talha send you?"" I said, ""Yes"". He said, ""For a meal?"" I said, ""Yes."" Then he said to his companions, ""Get up."" They set out and I was ahead of them.",Prayers (Salat),Sahih Bukhari,1,Sahih
423,Narrated Sahl bin Sa`d:,"A man said, ""O Allah's Messenger (ﷺ)! If a man finds another man with his wife, (committing adultery) should the husband kill him?"" Later on I saw them (the man and his wife) doing Li`an in the mosque (taking oaths, one accusing, and the other denying adultery).",Prayers (Salat),Sahih Bukhari,1,Sahih
424,Narrated `Itban bin Malik:,"The Prophet (ﷺ) came to my house and said, ""Where do you like me to pray?"" I pointed to a place. The Prophet then said, ""Allahu Akbar"", and we aligned behind him and he offered a two-rak`at prayer.",Prayers (Salat),Sahih Bukhari,1,Sahih
425,Narrated `Itban bin Malik رضی اللہ عنہ :,"Who was one of the companions of Allah's Messenger (ﷺ) and one of the Ansar's who took part in the battle of Badr: I came to Allah's Messenger (ﷺ) and said, ""O Allah's Messenger (ﷺ) I have weak eyesight and I lead my people in prayers. When it rains the water flows in the valley between me and my people so I cannot go to their mosque to lead them in prayer. O Allah's Messenger (ﷺ)! I wish you would come to my house and pray in it so that I could take that place as a Musalla. Allah's Messenger (ﷺ) said. ""Allah willing, I will do so."" Next day after the sun rose high, Allah's Messenger (ﷺ) and Abu Bakr came and Allah's Messenger (ﷺ) asked for permission to enter. I gave him permission and he did not sit on entering the house but said to me, ""Where do you like me to pray?"" I pointed to a place in my house. So Allah's Messenger (ﷺ) stood there and said, 'Allahu Akbar', and we all got up and aligned behind him and offered a two-rak`at prayer and ended it with Taslim. We requested him to stay for a meal called ""Khazira"" which we had prepared for him. Many members of our family gathered in the house and one of them said, ""Where is Malik bin Al-Dukhaishin or Ibn Al-Dukhshun?"" One of them replied, ""He is a hypocrite and does not love Allah and His Apostle."" Hearing that, Allah's Messenger (ﷺ) said, ""Do not say so. Haven't you seen that he said, 'None has the right to be worshipped but Allah' for Allah's sake only?"" He said, ""Allah and His Apostle know better. We have seen him helping and advising hypocrites."" Allah's Messenger (ﷺ) said, ""Allah has forbidden the (Hell) fire for those who say, 'None has the right to be worshipped but Allah' for Allah's sake only.""",Prayers (Salat),Sahih Bukhari,1,Sahih
426,Narrated `Aisha رضی اللہ عنہا :,"The Prophet (ﷺ) used to start every thing from the right (for good things) whenever it was possible in all his affairs; for example: in washing, combing or wearing shoes.",Prayers (Salat),Sahih Bukhari,1,Sahih
427,Narrated `Aisha رضی اللہ عنہا :,"Um Habiba رضی اللہ عنہا and Um Salama رضی اللہ عنہا mentioned about a church they had seen in Ethiopia in which there were pictures. They told the Prophet (ﷺ) about it, on which he said, ""If any religious man dies amongst those people they would build a place of worship at his grave and make these pictures in it. They will be the worst creature in the sight of Allah on the Day of Resurrection.""",Prayers (Salat),Sahih Bukhari,1,Sahih
428,Narrated Anas رضی اللہ عنہ :,"When the Prophet (ﷺ) arrived Medina he dismounted at `Awali-i-Medina amongst a tribe called Banu `Amr bin `Auf. He stayed there For fourteen nights. Then he sent for Bani An-Najjar and they came armed with their swords. As if I am looking (just now) as the Prophet (ﷺ) was sitting over his Rahila (Mount) with Abu Bakr riding behind him and all Banu An-Najjar around him till he dismounted at the courtyard of Abu Aiyub's house. The Prophet (ﷺ) loved to pray wherever the time for the prayer was due even at sheep-folds. Later on he ordered that a mosque should be built and sent for some people of Banu-An-Najjar and said, ""O Banu An-Najjar! Suggest to me the price of this (walled) piece of land of yours."" They replied, ""No! By Allah! We do not demand its price except from Allah."" Anas added: There were graves of pagans in it and some of it was unleveled and there were some date-palm trees in it. The Prophet (ﷺ) ordered that the graves of the pagans be dug out and the unleveled land be level led and the date-palm trees be cut down . (So all that was done). They aligned these cut date-palm trees towards the Qibla of the mosque (as a wall) and they also built two stone side-walls (of the mosque). His companions brought the stones while reciting some poetic verses. The Prophet (ﷺ) was with them and he kept on saying, ""There is no goodness except that of the Hereafter, O Allah! So please forgive the Ansars and the emigrants. """,Prayers (Salat),Sahih Bukhari,1,Sahih
429,Narrated Anas رضی اللہ عنہ :,"""The Prophet (ﷺ) prayed in the sheep fold."" Later on I heard him saying, ""He prayed in the sheep folds before the construction of the, mosque.""",Prayers (Salat),Sahih Bukhari,1,Sahih
430,Narrated Nafi`:,"""I saw Ibn `Umar praying while taking his camel as a Sutra in front of him and he said, ""I saw the Prophet doing the same.""",Prayers (Salat),Sahih Bukhari,1,Sahih
431,Narrated `Abdullah bin `Abbas رضی اللہ عنہما :,"The sun eclipsed and Allah's Messenger (ﷺ) offered the eclipse prayer and said, ""I have been shown the Hellfire (now) and I never saw a worse and horrible sight than the sight I have seen today.""",Prayers (Salat),Sahih Bukhari,1,Sahih
432,Narrated Ibn `Umar رضی اللہ عنہما :,"The Prophet (ﷺ) had said, ""Offer some of your prayers (Nawafil) at home, and do not take your houses as graves.""",Prayers (Salat),Sahih Bukhari,1,Sahih
