hadithNumber,englishNarrator,hadithEnglish,chapterEnglish,bookName,volume,status
4739,Narrated `Abdullah رضی اللہ عنہ :,"The Suras of Bani Israel, Al-Kahf, Mariyam, Taha and Al-Anbiya are from the very old Suras which I learnt by heart, and they are my first property. Qatadah says: ''جُذَاذًا‏'' means: To tear into pieces. Hasan Basri says: ''‏فِي فَلَكٍ‏'': The stars spin in the sky as the spinning-wheel spins. Hadrat Ibn-e- Abbas رضی اللہ عنہ says: ''نَفَشَتْ‏'' grazed. ''يُصْحَبُونَ‏': they will be prevented. ''‏أُمَّتُكُمْ أُمَّةً وَاحِدَةً‏'' in Ethiopian language it means fuel. The other learned people say: ''أَحَسُّوا‏'' means: Had an expectation from him. It is from ''خَامِدِينَ‏'' ''أَحْسَسْتُ‏'' means: extinguished. ''حَصِيدٌ'' uprooted. It is used for singlar dual and plual each. ''‏لاَ يَسْتَحْسِرُونَ‏'': they do not get sick of and ''حَسِيرٌ'' has been derived from it as ''حَسَرْتُ بَعِيرِي''. I have made my camel tired. ''عَمِيقٌ '': far- flung areas. ''نُكِسُوا‏'': turned back. ''صَنْعَةَ لَبُوسٍ'' coats of mail. ''‏تَقَطَّعُوا أَمْرَهُمْ‏'' differed. ''وَالْهَمْسُ '' , وَالْحِسُّ ''الْحَسِيسُ '' and ''وَالْجَرْسُ'' are synonyms mean faint sound. ''آذَنَّاكَ‏'' notified you. ''آذَنْتُكُمْ‏'' I informed you. So matter is on equal basis and we did not employ any treachery. ''‏لَعَلَّكُمْ تُسْأَلُونَ'': happily you may understand. ''ارْتَضَى‏'' agreed. '' التَّمَاثِيلُ‏'' idols, ''السِّجِلُّ'' means: register.",Prophetic Commentary on the Qur'an (Tafseer of the Prophet (PBUH)),Sahih Bukhari,6,Sahih
4740,Narrated Ibn `Abbas رضی اللہ عنہما :,"The Prophet (ﷺ) delivered a sermon and said, ""You (people) will be gathered before Allah (on the Day of Resurrection) bare-footed, naked and uncircumcised."" (The Prophet (ﷺ) then recited):-- 'As We began the first creation We shall repeat it. (It is) a promise We have undertaken and truly We shall do it.' and added, ""The first man who will be dressed on the Day of Resurrection, will be Abraham. Lo! Some men from my followers will be brought and taken towards the left side, whereupon I will say, 'O Lord, (these are) my companions!' It will be said, 'You do not know what new things they introduced (into the religion) after you.' I will then say as the righteous pious slave, Jesus, said, 'I was a witness over them while I dwelt among them...(to His Statement)..and You are the Witness to all things.' (5.117) Then it will be said, '(O Muhammad) These people never stopped to apostate since you left them.""",Prophetic Commentary on the Qur'an (Tafseer of the Prophet (PBUH)),Sahih Bukhari,6,Sahih
4741,Narrated Abu Sa`id Al-Khudri رضی اللہ عنہ :,"The Prophet (ﷺ) said, ""On the day of Resurrection Allah will say, 'O Adam!' Adam will reply, 'Labbaik our Lord, and Sa`daik ' Then there will be a loud call (saying), Allah orders you to take from among your offspring a mission for the (Hell) Fire.' Adam will say, 'O Lord! Who are the mission for the (Hell) Fire?' Allah will say, 'Out of each thousand, take out 999.' At that time every pregnant female shall drop her load (have a miscarriage) and a child will have grey hair. And you shall see mankind as in a drunken state, yet not drunk, but severe will be the torment of Allah."" (22.2) (When the Prophet (ﷺ) mentioned this), the people were so distressed (and afraid) that their faces got changed (in color) whereupon the Prophet (ﷺ) said, ""From Gog and Magog nine-hundred ninety-nine will be taken out and one from you. You Muslims (compared to the large number of other people) will be like a black hair on the side of a white ox, or a white hair on the side of a black ox, and I hope that you will be onefourth of the people of Paradise."" On that, we said, ""Allahu-Akbar!"" Then he said, ""I hope that you will be) one-third of the people of Paradise."" We again said, ""Allahu-Akbar!"" Then he said, ""(I hope that you will be) one-half of the people of Paradise."" So we said, Allahu Akbar."" He inhabitants of Paradise. Whereupon, we again shouted; Allah is the Greatest. Abu Osamah has reported from Amash: you will see people as they are drunk and they will not be drunk and said: Nine-hundred and ninety-nine out of each thousand. Jareer, Isa bin younus and Abu Moaviyah said: They are drunk and they will not be drunk.",Prophetic Commentary on the Qur'an (Tafseer of the Prophet (PBUH)),Sahih Bukhari,6,Sahih
4742,Narrated Ibn `Abbas رضی اللہ عنہما :,"Regarding the Verse: ""And among men is he who worships Allah's as it were on the very edge."" (22.11). A man used to come to Medina as if his wife brought a son and his mares produces offspring. He would say, ""This religion (Islam) is good,"" but if his wife did not give birth to a child and his mares produced no offspring, he would say, ""This religion is bad.""",Prophetic Commentary on the Qur'an (Tafseer of the Prophet (PBUH)),Sahih Bukhari,6,Sahih
4743,Narrated Abu Dharr رضی اللہ عنہ :,"He used to take an oath confirming that the Verse: 'These two opponents (believers, and disbelievers) dispute with each other about their Lord.' (22.19) was Revealed in connection with Hamza and his two companions and `Utbah and his two companions on the day when they ease out of the battle of Badr. Sufyan has reported it from Abu Hashim. Uthman, Jareer, Masoor, Abu Hashim reported his saying from Abu Mijliz.",Prophetic Commentary on the Qur'an (Tafseer of the Prophet (PBUH)),Sahih Bukhari,6,Sahih
4744,Narrated Qais bin Ubad:,"`Ali رضی اللہ عنہ said, ""I will be the first to kneel before the Beneficent on the Day of Resurrection because of the dispute."" Qais said; This Verse: 'These two opponents (believers and disbelievers dispute with each other about their Lord,' (22.19) was revealed in connection with those who came out for the Battle of Badr, i.e. `Ali, Hamza, 'Ubaida, Shaiba bin Rabi`a, `Utba bin Rabi`a and Al-Walid bin `Utba.",Prophetic Commentary on the Qur'an (Tafseer of the Prophet (PBUH)),Sahih Bukhari,6,Sahih
4745,Narrated Sahl bin Saud:,"Uwaimir came to `Asim bin `Adi who was the chief of Bani Ajlan and said, ""What do you say about a man who has found another man with his wife? Should he kill him whereupon you would kill him (i.e. the husband), or what should he do? Please ask Allah's Messenger (ﷺ) about this matter on my behalf."" `Asim then went to the Prophet (ﷺ) and said, ""O Allah's Messenger (ﷺ)! (And asked him that question) but Allah's Messenger (ﷺ) disliked the question,"" When 'Uwaimir asked `Asim (about the Prophet's answer) `Asim replied that Allah's Messenger (ﷺ) disliked such questions and considered it shameful. ""Uwaimir then said, ""By Allah, I will not give up asking unless I ask Allah's Messenger (ﷺ) about it."" Uwaimir came (to the Prophet ) and said, ""O Allah's Messenger (ﷺ)! A man has found another man with his wife! Should he kill him whereupon you would kill him (the husband, in Qisas) or what should he do?"" Allah's Messenger (ﷺ) said, ""Allah has revealed regarding you and your wife's case in the Qur'an ""So Allah's Messenger (ﷺ) ordered them to perform the measures of Mula'ana according to what Allah had mentioned in His Book. So 'Uwaimir did Mula'ana with her and said, ""O Allah's Messenger (ﷺ)! If I kept her I would oppress her."" So 'Uwaimir divorced her and so divorce became a tradition after them for those who happened to be involved in a case of Mula'ana. Allah's Messenger (ﷺ) then said, ""Look! If she (Uwaimir's wife) delivers a black child with deep black large eyes, big hips and fat legs, then I will be of the opinion that 'Uwaimir has spoken the truth; but if she delivers a red child looking like a Wahra then we will consider that 'Uwaimir has told a lie against her."" Later on she delivered a child carrying the qualities which Allah's Messenger (ﷺ) had mentioned as a proof for 'Uwaimir's claim; therefore the child was ascribed to its mother henceforth.",Prophetic Commentary on the Qur'an (Tafseer of the Prophet (PBUH)),Sahih Bukhari,6,Sahih
4746,Narrated Sahl bin Sa`d:,"A man came to Allah's Messenger (ﷺ) and said, ""O Allah's Messenger (ﷺ)! Suppose a man saw another man with his wife, should he kill him whereupon you might kill him (i.e. the killer) (in Qisas) or what should he do?"" So Allah revealed concerning their case what is mentioned of the order of Mula'ana. Allah's Apostle said to the man, ""The matter between you and your wife has been decided."" So they did Mula'ana in the presence of Allah's Messenger (ﷺ) and I was present there, and then the man divorced his wife. So it became a tradition to dissolve the marriage of those spouses who were involved in a case of Mula'ana. The woman was pregnant and the husband denied that he was the cause of her pregnancy, so the son was (later) ascribed to her. Then it became a tradition that such a son would be the heir of his mother, and she would inherit of him what Allah prescribed for her.",Prophetic Commentary on the Qur'an (Tafseer of the Prophet (PBUH)),Sahih Bukhari,6,Sahih
4747,Narrated Ibn `Abbas رضی اللہ عنہما :,"Hilal bin Umaiya accused his wife of committing illegal sexual intercourse with Sharik bin Sahma' and filed the case before the Prophet. The Prophet (ﷺ) said (to Hilal), ""Either you bring forth a proof (four witnesses) or you will receive the legal punishment (lashes) on your back."" Hilal said, ""O Allah's Apostle! If anyone of us saw a man over his wife, would he go to seek after witnesses?"" The Prophet (ﷺ) kept on saying, ""Either you bring forth the witnesses or you will receive the legal punishment (lashes) on your back."" Hilal then said, ""By Him Who sent you with the Truth, I am telling the truth and Allah will reveal to you what will save my back from legal punishment."" Then Gabriel came down and revealed to him:-- 'As for those who accuse their wives...' (24.6-9) The Prophet (ﷺ) recited it till he reached: '... (her accuser) is telling the truth.' Then the Prophet (ﷺ) left and sent for the woman, and Hilal went (and brought) her and then took the oaths (confirming the claim). The Prophet (ﷺ) was saying, ""Allah knows that one of you is a liar, so will any of you repent?"" Then the woman got up and took the oaths and when she was going to take the fifth one, the people stopped her and said, ""It (the fifth oath) will definitely bring Allah's curse on you (if you are guilty)."" So she hesitated and recoiled (from taking the oath) so much that we thought that she would withdraw her denial. But then she said, ""I will not dishonor my family all through these days,"" and carried on (the process of taking oaths). The Prophet (ﷺ) then said, ""Watch her; if she delivers a black-eyed child with big hips and fat shins then it is Sharik bin Sahma's child."" Later she delivered a child of that description. So the Prophet (ﷺ) said, ""If the case was not settled by Allah's Law, I would punish her severely.""",Prophetic Commentary on the Qur'an (Tafseer of the Prophet (PBUH)),Sahih Bukhari,6,Sahih
4748,Narrated Ibn `Umar رضی اللہ عنہما :,"A man accused his wife of illegal sexual intercourse and denied his paternity to her (conceived) child during the lifetime of Allah's Messenger (ﷺ). Allah's Messenger (ﷺ) ordered them both to do Mula'ana as Allah decreed and then gave his decision that the child would be for the mother, and a divorce decree was issued for the couple involved in a case of Mula'ana.",Prophetic Commentary on the Qur'an (Tafseer of the Prophet (PBUH)),Sahih Bukhari,6,Sahih
