hadithNumber,englishNarrator,hadithEnglish,chapterEnglish,bookName,volume,status
3956,Narrated Al-Bara رضی اللہ عنہ :,"I and Ibn `Umar رضی اللہ عنہما were considered too young (to take part) in the battle of Badr, and the number of the Emigrant warriors were over sixty (men) and the Ansar were over 240.",Military Expeditions led by the Prophet (PBUH) (Al-Maghaazi),Sahih Bukhari,5,Sahih
3957,Narrated Al-Bara رضی اللہ عنہ :,"The companions of (the Prophet) Muhammad who took part in Badr, told me that their number was that of Saul's (i.e. Talut's) companions who crossed the river (of Jordan) with him and they were over three-hundred-and-ten men. Hadrat Braa رضی اللہ عنہ says: By Allah, none crossed the river with him but a believer. (See Qur'an 2:249)",Military Expeditions led by the Prophet (PBUH) (Al-Maghaazi),Sahih Bukhari,5,Sahih
3958,Narrated Al-Bara رضی اللہ عنہ :,"We, the Companions of Muhammad used to say that the number of the warriors of Badr was the same as the number of Saul's companions who crossed the river (of Jordan) with him, and none crossed the river with him but a believer, and the were over three-hundred-and-ten men.",Military Expeditions led by the Prophet (PBUH) (Al-Maghaazi),Sahih Bukhari,5,Sahih
3959,Narrated Al-Bara رضی اللہ عنہ :,"We used to say that the warriors of Badr were over three-hundred-and-ten, as many as the Taloot's Companions of Saul who crossed the river with him; and none crossed the river with him but a believer.",Military Expeditions led by the Prophet (PBUH) (Al-Maghaazi),Sahih Bukhari,5,Sahih
3960,Narrated `Abdullah bin Mas`ud رضی اللہ عنہ :,"The Prophet (ﷺ) faced the Ka`ba and invoked evil on some people of Quraish, on Shaiba bin Rabi`a, `Utba bin Rabi`a, Al-Walid bin `Utba and Abu Jahl bin Hisham. I bear witness, by Allah, that I saw them all dead in Badr and their corpses had due to heat, and that day was really a scorcher.",Military Expeditions led by the Prophet (PBUH) (Al-Maghaazi),Sahih Bukhari,5,Sahih
3961,Narrated `Abdullah رضی اللہ عنہ :,"On the day of the Battle of Badr, I reached near Abu Jehl while there were still some signs of life in him. So Abu Jahl said to me: Is there anyone better than I amongst the people you have killed?",Military Expeditions led by the Prophet (PBUH) (Al-Maghaazi),Sahih Bukhari,5,Sahih
3962,Narrated Anas رضی اللہ عنہ :,"The Prophet (ﷺ) said, ""Who will go and see what has happened to Abu Jahl?"" Ibn Mas`ud went and found that the two sons of 'Afra had struck him fatally (and he was in his last breaths). `Abdullah bin Mas`ud رضی اللہ عنہ said, ""Are you Abu Jahl?"" And took him by the beard. Abu Jahl said, ""Can there be a man superior to one you have killed or one whom his own folk have killed?"" Ahmad bin Yousuf' report also contains ''أَنْتَ أَبُو جَهْلٍ'' .",Military Expeditions led by the Prophet (PBUH) (Al-Maghaazi),Sahih Bukhari,5,Sahih
3963,Narrated Anas رضی اللہ عنہ :,"On the day of Badr, the Prophet (ﷺ) said, ""Who will go and see what has happened to Abu Jahl?"" Ibn Mas`ud went and found that the two sons of 'Afra had struck him fatally. `Abdullah bin Mas`ud got hold of his beard and said, ""'Are you Abu Jahl?"" He replied, ""Can there be a man more superior to one whom his own folk have killed (or you have killed)?"" Hadrat Anas bin Malik رضی اللہ عنہ has also reported the same.",Military Expeditions led by the Prophet (PBUH) (Al-Maghaazi),Sahih Bukhari,5,Sahih
3964,Narrated `Abdur-Rahman bin `Auf (the grandfather of Salih bin Ibrahim):,"The story of Badr, namely, the narration regarding the sons of 'Afra'.",Military Expeditions led by the Prophet (PBUH) (Al-Maghaazi),Sahih Bukhari,5,Sahih
3965,Narrated Ali bin Abi Talib رضی اللہ عنہ :,"""I shall be the first man to kneel down before (Allah), the Beneficent to receive His judgment on the day of Resurrection (in my favor)."" Qais bin Ubad also said, ""The following Verse was revealed in their connection:-- ""These two opponents believers and disbelievers) Dispute with each other About their Lord."" (22.19) Qais said that they were those who fought on the day of Badr, namely, Hamza, `Ali, 'Ubaida or Abu 'Ubaida bin Al-Harith, Shaiba bin Rabi`a, `Utba and Al-Wahd bin `Utba.",Military Expeditions led by the Prophet (PBUH) (Al-Maghaazi),Sahih Bukhari,5,Sahih
3966,Narrated Abu Dhar رضی اللہ عنہ :,"The following Holy Verse:-- ""These two opponents (believers & disbelievers) dispute with each other about their Lord,"" (22.19) was revealed concerning six men from Quraish, namely, `Ali, Hamza, 'Ubaida bin Al-Harith; Shaiba bin Rabi`a, `Utba bin Rabi`a and Al-Walid bin `Utba.",Military Expeditions led by the Prophet (PBUH) (Al-Maghaazi),Sahih Bukhari,5,Sahih
3967,Narrated `Ali رضی اللہ عنہ:,"The following Holy Verse:-- ""These two opponents (believers and disbelievers) dispute with each other about their Lord."" (22.19) was revealed concerning us.",Military Expeditions led by the Prophet (PBUH) (Al-Maghaazi),Sahih Bukhari,5,Sahih
3968,Narrated Abu Dhar رضی اللہ عنہ :,"These Holy Verses were revealed in connection with those six persons on the day of Badr, and then he reported as per former Hadith.",Military Expeditions led by the Prophet (PBUH) (Al-Maghaazi),Sahih Bukhari,5,Sahih
3969,Narrated Abu Dhar رضی اللہ عنہ :,"The following Holy verse:-- ""These two opponents (believers and disbelievers) disputing with each other about their Lord,"" (22.19) was revealed concerning those men who fought on the day of Badr, namely, Hamza, `Ali, Ubaida bin Al-Harith رضی اللہ عنہم , `Utba and Shaiba----the two sons of Rabi`a-- and Al-Walid bin `Utba.",Military Expeditions led by the Prophet (PBUH) (Al-Maghaazi),Sahih Bukhari,5,Sahih
3970,Narrated Abu 'Is-haq:,"A man asked Al-Bara' رضی اللہ عنہ and I was listening, ""Did `Ali رضی اللہ عنہ take part in (the battle of) Badr?"" Al-Bara' said, ""(Yes). he even met (his enemies) in a duel and was clad in two armors (one over the other).",Military Expeditions led by the Prophet (PBUH) (Al-Maghaazi),Sahih Bukhari,5,Sahih
3971,Narrated `Abdur-Rahman bin `Auf رضی اللہ عنہ :,"""I had an agreement with Umaiya bin Khalaf (that he would look after my relatives and property in Mecca, and I would look after his relatives and property in Medina)."" `Abdur-Rahman then mentioned the killing of Umaiya and his son on the day of Badr, and Bilal said, ""Woe to me if Umaiya remains safe (i.e. alive), I will not get delivered (on the Resurrection Day).",Military Expeditions led by the Prophet (PBUH) (Al-Maghaazi),Sahih Bukhari,5,Sahih
3972,Narrated 'Abdullah رضی اللہ عنہ :,"The Prophet (ﷺ) recited Surat-an-Najm and then prostrated himself, and all who were with him prostrated too. But an old man took a handful of dust and touched his forehead with it saying, ""This is sufficient for me. Hadrat Abdullah رضی اللہ عنہ says: "" Later on I saw him killed as an infidel.",Military Expeditions led by the Prophet (PBUH) (Al-Maghaazi),Sahih Bukhari,5,Sahih
3973,Narrated 'Urwa (the son of Az- Zubair):,"Az-Zubair رضی اللہ عنہ had three scars caused by the sword, one of which was over his shoulder and I used to insert my fingers in it. He received two of those wounds on the day of Badr and one on the day of Al-Yarmuk. When 'Abdullah bin Zubair was killed, 'Abdul-Malik bin Marwan said to me, ""O 'Urwa, do you recognize the sword of Az-Zubair رضی اللہ عنہ ?"" I said, ""Yes."" He said, ""What marks does it have?"" I replied, ""It has a dent in its sharp edge which was caused in it on the day of Badr."" 'Abdul- Malik said, ""You are right! (i.e. their swords) have dents because of clashing with the regiments of the enemies Then 'Abdul-Malik returned that sword to me (i.e. Urwa). (Hisham, 'Urwa's son said, ""We estimated the price of the sword as three-thousand (Dinars) and after that it was taken by one of us (i.e. the inheritors) and I wish I could have had it."")",Military Expeditions led by the Prophet (PBUH) (Al-Maghaazi),Sahih Bukhari,5,Sahih
3974,Narrated Hisham رضی اللہ عنہ with the reference to his father:,"That his father said, ""The sword of Az-Zubair رضی اللہ عنہ was decorated with silver."" Hisham added, ""The sword of `Urwa was (also) decorated with silver. """,Military Expeditions led by the Prophet (PBUH) (Al-Maghaazi),Sahih Bukhari,5,Sahih
3975,Narrated `Urwa:,"On the day of (the battle) of Al-Yarmuk, the companions of Allah's Messenger (ﷺ) said to Az-Zubair رضی اللہ عنہ , ""Will you attack the enemy so that we shall attack them with you?"" Az-Zubair رضی اللہ عنہ replied, ""If I attack them, you people would not support me."" They said, ""No, we will support you."" So Az-Zubair رضی اللہ عنہ attacked them (i.e. Byzantine) and pierced through their lines, and went beyond them and none of his companions was with him. Then he returned and the enemy got hold of the bridle of his (horse) and struck him two blows (with the sword) on his shoulder. Between these two wounds there was a scar caused by a blow, he had received on the day of Badr (battle). When I was a child I used to play with those scars by putting my fingers in them. On that day (my brother) ""Abdullah bin Az-Zubair رضی اللہ عنہ was also with him and he was ten years old. Az-Zubair رضی اللہ عنہ had carried him on a horse and let him to the care of some men.",Military Expeditions led by the Prophet (PBUH) (Al-Maghaazi),Sahih Bukhari,5,Sahih
3976,Narrated Abu Talha رضی اللہ عنہ :,"On the day of Badr, the Prophet (ﷺ) ordered that the corpses of twenty four leaders of Quraish should be thrown into one of the dirty dry wells of Badr. (It was a habit of the Prophet (ﷺ) that whenever he conquered some people, he used to stay at the battle-field for three nights. So, on the third day of the battle of Badr, he ordered that his she-camel be saddled, then he set out, and his companions followed him saying among themselves."" ""Definitely he (i.e. the Prophet) is proceeding for some great purpose."" When he halted at the edge of the well, he addressed the corpses of the Quraish infidels by their names and their fathers' names, ""O so-and-so, son of so-and-so and O so-and-so, son of so-andso! Would it have pleased you if you had obeyed Allah and His Apostle? We have found true what our Lord promised us. Have you too found true what your Lord promised you? ""`Umar رضی اللہ عنہ said, ""O Allah's Messenger (ﷺ)! You are speaking to bodies that have no souls!"" Allah's Messenger (ﷺ) said, ""By Him in Whose Hand Muhammad's soul is, you do not hear, what I say better than they do."" (Qatada said, ""Allah brought them to life (again) to let them hear him, to reprimand them and slight them and take revenge over them and caused them to feel remorseful and regretful."")",Military Expeditions led by the Prophet (PBUH) (Al-Maghaazi),Sahih Bukhari,5,Sahih
3977,Narrated Ibn `Abbas رضی اللہ عنہما :,"By Allah! These are the Infidels of the Quraish who change the favour with unthankfulness. Amr (bin Dinaar), the sub narrator says: They (who changed the favour with unthankfulness) are the Quraish, and Muhammad is the favour of Allah. And the Verse: ''And they have brought their people into the abode of ruin,'' means they reached Hell on the day of Badr.",Military Expeditions led by the Prophet (PBUH) (Al-Maghaazi),Sahih Bukhari,5,Sahih
"3978, 3979",Narrated Hisham's father:,"It was mentioned before `Aisha رضی اللہ عنہا that Ibn `Umar رضی اللہ عنہما attributed the following statement to the Prophet (ﷺ) ""The dead person is punished in the grave because of the crying and lamentation Of his family."" On that, `Aisha رضی اللہ عنہا said, ""But Allah's Messenger (ﷺ) said, 'The dead person is punished for his crimes and sins while his family cry over him then."" She added, ""And this is similar to the statement of Allah's Messenger (ﷺ) when he stood by the (edge of the) well which contained the corpses of the pagans killed at Badr, 'They hear what I say.' She added, ""But he said now they know very well what I used to tell them was the truth."" `Aisha رضی اللہ عنہا then recited: 'You cannot make the dead hear.' (30.52) and 'You cannot make those who are in their Graves, hear you.' (35.22) that is, when they had taken their places in the (Hell) Fire.",Military Expeditions led by the Prophet (PBUH) (Al-Maghaazi),Sahih Bukhari,5,Sahih
"3980, 3981",Narrated Ibn `Umar رضی اللہ عنہما :,"The Prophet (ﷺ) stood at the well of Badr (which contained the corpses of the pagans) and said, ""Have you found true what your lord promised you?"" Then he further said, ""They now hear what I say."" This was mentioned before `Aisha رضی اللہ عنہا and she said, ""But the Prophet (ﷺ) said, 'Now they know very well that what I used to tell them was the truth.' Then she recited (the Holy Verse):-- ""You cannot make the dead hear... ...till the end of Verse)."" (30.52)",Military Expeditions led by the Prophet (PBUH) (Al-Maghaazi),Sahih Bukhari,5,Sahih
3982,Narrated Anas رضی اللہ عنہ :,"Haritha was martyred on the day (of the battle) of Badr, and he was a young boy then. His mother came to the Prophet (ﷺ) and said, ""O Allah's Messenger (ﷺ)! You know how dear Haritha is to me. If he is in Paradise, I shall remain patient, and hope for reward from Allah, but if it is not so, then you shall see what I do?"" He said, ""May Allah be merciful to you! Have you lost your senses? Do you think there is only one Paradise? There are many Paradises and your son is in the (most superior) Paradise of Al- Firdaus.""",Military Expeditions led by the Prophet (PBUH) (Al-Maghaazi),Sahih Bukhari,5,Sahih
