hadithNumber,englishNarrator,hadithEnglish,chapterEnglish,bookName,volume,status
2085,Narrated Samura bin Jundab رضی اللہ عنہ :,"The Prophet (ﷺ) said, ""This night I dreamt that two men came and took me to a Holy land whence we proceeded on till we reached a river of blood, where a man was standing, and on its bank was standing another man with stones in his hands. The man in the middle of the river tried to come out, but the other threw a stone in his mouth and forced him to go back to his original place. So, whenever he tried to come out, the other man would throw a stone in his mouth and force him to go back to his former place. I asked, 'Who is this?' I was told, 'The person in the river was a Riba-eater.""",Sales and Trade,Sahih Bukhari,3,Sahih
2086,Narrated `Aun bin Abu Juhaifa:,"My father bought a slave who practiced the profession of cupping. (My father broke the slave's instruments of cupping). I asked my father why he had done so. He replied, ""The Prophet (ﷺ) forbade the acceptance of the price of a dog or blood, and also forbade the profession of tattooing, getting tattooed and receiving or giving Riba, (usury), and cursed the picture-makers.""",Sales and Trade,Sahih Bukhari,3,Sahih
2087,Narrated Abu Huraira رضی اللہ عنہ :,"I heard Allah's Messenger (ﷺ) saying, ""The swearing (by the seller) may persuade the buyer to purchase the goods but that will be deprived of Allah's blessing.""",Sales and Trade,Sahih Bukhari,3,Sahih
2088,Narrated `Abdullah bin Abu `Aufa رضی اللہ عنہ :,"A man displayed some goods in the market and swore by Allah that he had been offered so much for that, that which was not offered, and he said so, so as to cheat a Muslim. On that occasion the following Verse was revealed: ""Verily! Those who purchase a small gain at the cost of Allah's covenant and their oaths (They shall have no portion in the Hereafter ..etc.)' (3.77)",Sales and Trade,Sahih Bukhari,3,Sahih
2089,Narrated `Ali رضی اللہ عنہ :,"I got an old she-camel as my share from the booty, and the Prophet (ﷺ) had given me another from Al- Khumus. And when I intended to marry Fatima رضی اللہ عنہا (daughter of the Prophet), I arranged that a goldsmith from the tribe of Bani Qainuqa' would accompany me in order to bring Idhkhir and then sell it to the goldsmiths and use its price for my marriage banquet.",Sales and Trade,Sahih Bukhari,3,Sahih
2090,Narrated Ibn `Abbas رضی اللہ عنہما :,"Allah's Messenger (ﷺ) said, ""Allah made Mecca a sanctuary and it was neither permitted for anyone before, nor will it be permitted for anyone after me (to fight in it). And fighting in it was made legal for me for a few hours of a day only. None is allowed to uproot its thorny shrubs or to cut down its trees or to chase its game or to pick up its Luqata (fallen things) except by a person who would announce it publicly."" `Abbas bin `Abdul-Muttalib رضی اللہ عنہ requested the Prophet, ""Except Al-Idhkhir, for our goldsmiths and for the roofs of our houses."" The Prophet (ﷺ) said, ""Except Al-Idhkhir."" `Ikrima said, ""Do you know what is meant by chasing its game? It is to drive it out of the shade and sit in its place."" Khalid said, ""(`Abbas said: Al-Idhkhir) for our goldsmiths and our graves.""",Sales and Trade,Sahih Bukhari,3,Sahih
2091,Narrated Khabbab رضی اللہ عنہ :,"I was a blacksmith in the Pre-Islamic period, and 'Asi bin Wail owed me some money, so I went to him to demand it. He said (to me), ""I will not pay you unless you disbelieve Muhammad."" I said, ""I will not disbelieve till Allah kills you and then you get resurrected."" He said, ""Leave me till I die and get resurrected, then I will be given wealth and children and I will pay you your debt."" On that occasion it was revealed to the Prophet: 'Have you seen him who disbelieved in Our signs and says: Surely I will be given wealth and children? Has he known the unseen, or has he taken a covenant from the Beneficent (Allah)? (19.77- 78)",Sales and Trade,Sahih Bukhari,3,Sahih
2092,Narrated Anas bin Malik رضی اللہ عنہ :,"""A tailor invited Allah's Messenger (ﷺ) to a meal which he had prepared. "" Anas bin Malik رضی اللہ عنہ said, ""I accompanied Allah's Messenger (ﷺ) to that meal. He served the Prophet (ﷺ) with bread and soup made with gourd and dried meat. I saw the Prophet (ﷺ) taking the pieces of gourd from the dish."" Anas added, ""Since that day I have continued to like gourd.""",Sales and Trade,Sahih Bukhari,3,Sahih
2093,Narrated Sahl bin Sa`d رضی اللہ عنہ :,"""A woman brought a Burda (i.e. a square piece of cloth having edging). I asked, 'Do you know what a Burda is?' They replied in the affirmative and said, ""It is a cloth sheet with woven margins."" Sahl went on, ""She addressed the Prophet (ﷺ) and said, 'I have woven it with my hands for you to wear.' The Prophet (ﷺ) took it as he was in need of it, and came to us wearing it as a waist sheet. One of us said, 'O Allah's Messenger (ﷺ)! Give it to me to wear.' The Prophet (ﷺ) agreed to give it to him. The Prophet (ﷺ) sat with the people for a while and then returned (home), wrapped that waist sheet and sent it to him. The people said to that man, 'You haven't done well by asking him for it when you know that he never turns down anybody's request.' The man replied, 'By Allah, I have not asked him for it except to use it as my shroud when I die."" Sahl رضی اللہ عنہ added; ""Later it (i.e. that sheet) was his shroud.""",Sales and Trade,Sahih Bukhari,3,Sahih
2094,Narrated Abu Hazim:,"Some men came to Sahl bin Sa`d رضی اللہ عنہ to ask him about the pulpit. He replied, ""Allah's Messenger (ﷺ) sent for a woman (Sahl named her) (this message): 'Order your slave carpenter to make pieces of wood (i.e. a pulpit) for me so that I may sit on it while addressing the people.' So, she ordered him to make it from the tamarisk of the forest. He brought it to her and she sent it to Allah's Messenger (ﷺ) . Allah's Messenger (ﷺ) ordered it to be placed in the mosque: so, it was put and he sat on it.",Sales and Trade,Sahih Bukhari,3,Sahih
2095,Narrated Jabir bin `Abdullah رضی اللہ عنہما :,"An Ansari woman said to Allah's Messenger (ﷺ), ""O Allah's Messenger (ﷺ)! Shall I make something for you to sit on, as I have a slave who is a carpenter?"" He replied, ""If you wish."" So, she got a pulpit made for him. When it was Friday the Prophet (ﷺ) sat on that pulpit. The date-palm stem near which the Prophet (ﷺ) used to deliver his sermons cried so much so that it was about to burst. The Prophet (ﷺ) came down from the pulpit to the stem and embraced it and it started groaning like a child being persuaded to stop crying and then it stopped crying. The Prophet (ﷺ) said,""It has cried because of (missing) what it use to hear of the religions knowledge.""",Sales and Trade,Sahih Bukhari,3,Sahih
2096,Narrated `Aisha رضی اللہ عنہا :,Allah's Messenger (ﷺ) bought food grains from a Jew on credit and mortgaged his armor to him.,Sales and Trade,Sahih Bukhari,3,Sahih
2097,Narrated Jabir bin `Abdullah رضی اللہ عنہما :,"I was with the Prophet (ﷺ) in a Ghazwa (Military Expedition) and my camel was slow and exhausted. The Prophet came up to me and said, ""O Jabir."" I replied, ""Yes?"" He said, ""What is the matter with you?"" I replied, ""My camel is slow and tired, so I am left behind."" So, he got down and poked the camel with his stick and then ordered me to ride. I rode the camel and it became so fast that I had to hold it from going ahead of Allah's Messenger (ﷺ) . He then asked me, have you got married?"" I replied in the affirmative. He asked, ""A virgin or a matron?"" I replied, ""I married a matron."" The Prophet (ﷺ) said, ""Why have you not married a virgin, so that you may play with her and she may play with you?"" Jabir replied, ""I have sisters (young in age) so I liked to marry a matron who could collect them all and comb their hair and look after them."" The Prophet (ﷺ) said, ""You will reach, so when you have arrived (at home), I advise you to associate with your wife (that you may have an intelligent son)."" Then he asked me, ""Would you like to sell your camel?"" I replied in the affirmative and the Prophet (ﷺ) purchased it for one Uqiya of gold. Allah's Messenger (ﷺ) reached before me and I reached in the morning, and when I went to the mosque, I found him at the door of the mosque. He asked me, ""Have you arrived just now?"" I replied in the affirmative. He said, ""Leave your camel and come into (the mosque) and pray two rak`at."" I entered and offered the prayer. He told Bilal to weigh and give me one Uqiya of gold. So Bilal weighed for me fairly and I went away. The Prophet (ﷺ) sent for me and I thought that he would return to me my camel which I hated more than anything else. But the Prophet (ﷺ) said to me, ""Take your camel as well as its price.""",Sales and Trade,Sahih Bukhari,3,Sahih
2098,Narrated Ibn `Abbas رضی اللہ عنہما :,"`Ukaz, Majanna and Dhul-Majaz were markets in the Pre-Islamic period. When the people embraced Islam they considered it a sin to trade there. So, the following Holy Verse came:-- 'There is no harm for you if you seek of the bounty of your Lord (Allah) in the Hajj season."" (2.198) Ibn `Abbas رضی اللہ عنہما recited it like this.",Sales and Trade,Sahih Bukhari,3,Sahih
2099,Narrated `Amr:,"Here (i.e. in Mecca) there was a man called Nawwas and he had camels suffering from the disease of excessive and unquenchable thirst. Ibn `Umar went to the partner of Nawwas and bought those camels. The man returned to Nawwas and told him that he had sold those camels. Nawwas asked him, ""To whom have you sold them?"" He replied, ""To such and such Sheikh."" Nawwas said, ""Woe to you; By Allah, that Sheikh was Ibn `Umar رضی اللہ عنہما ."" Nawwas then went to Ibn `Umar and said to him, ""My partner sold you camels suffering from the disease of excessive thirst and he had not known you."" Ibn `Umar told him to take them back. When Nawwas went to take them, Ibn `Umar رضی اللہ عنہما said to him, ""Leave them there as I am happy with the decision of Allah's Messenger (ﷺ) that there is no oppression . "" Sufyan heard from Amr.",Sales and Trade,Sahih Bukhari,3,Sahih
2100,Narrated Abu Qatada رضی اللہ عنہ :,"We set out with Allah's Messenger (ﷺ) in the year of Hunain, (the Prophet (ﷺ) gave me an armor). I sold that armor and bought a garden in the region of the tribe of Bani Salama and that was the first property I got after embracing Islam.",Sales and Trade,Sahih Bukhari,3,Sahih
2101,Narrated Abu Musa رضی اللہ عنہ :,"Allah's Messenger (ﷺ) said, ""The example of a good companion (who sits with you) in comparison with a bad one, is like that of the musk seller and the blacksmith's bellows (or furnace); from the first you would either buy musk or enjoy its good smell while the bellows would either burn your clothes or your house, or you get a bad nasty smell thereof.""",Sales and Trade,Sahih Bukhari,3,Sahih
2102,Narrated Anas bin Malik رضی اللہ عنہ :,Abu Taiba رضی اللہ عنہ cupped Allah's Messenger (ﷺ) so he ordered that he be paid one Sa of dates and ordered his masters to reduce his tax (as he was a slave and had to pay a tax to them).,Sales and Trade,Sahih Bukhari,3,Sahih
2103,Narrated Ibn `Abbas رضی اللہ عنہما :,"Once the Prophet (ﷺ) got his blood out (medically) and paid that person who had done it. If it had been illegal, the Prophet (ﷺ) would not have paid him.",Sales and Trade,Sahih Bukhari,3,Sahih
2104,Narrated `Abdullah bin `Umar رضی اللہ عنہما :,"Once the Prophet (ﷺ) sent to `Umar رضی اللہ عنہ a silken two-piece garment, and when he saw `Umar wearing it, he said to him, ""I have not sent it to you to wear. It is worn by him who has no share in the Hereafter, and I have sent it to you so that you could benefit by it (i.e. sell it).",Sales and Trade,Sahih Bukhari,3,Sahih
2105,Narrated Aisha رضی اللہ عنہا (mother of the faithful believers):,"I bought a cushion with pictures on it. When Allah's Messenger (ﷺ) saw it, he kept standing at the door and did not enter the house. I noticed the sign of disgust on his face, so I said, ""O Allah's Messenger (ﷺ)! I repent to Allah and H is Apostle . (Please let me know) what sin I have done."" Allah's Messenger (ﷺ) said, ""What about this cushion?"" I replied, ""I bought it for you to sit and recline on."" Allah's Messenger (ﷺ) said, ""The painters (i.e. owners) of these pictures will be punished on the Day of Resurrection. It will be said to them, 'Put life in what you have created (i.e. painted).' "" The Prophet (ﷺ) added, ""The angels do not enter a house where there are pictures.""",Sales and Trade,Sahih Bukhari,3,Sahih
2106,Narrated Anas رضی اللہ عنہ :,"The Prophet (ﷺ) said, ""O Bani Najjar! Suggest a price for your garden."" Part of it was a ruin and it contained some date palms.",Sales and Trade,Sahih Bukhari,3,Sahih
2107,Narrated Ibn `Umar رضی اللہ عنہما :,"The Prophet (ﷺ) said, ""The buyer and the seller have the option to cancel or confirm the bargain before they separate from each other or if the sale is optional."" Nafi` said, ""Ibn `Umar رضی اللہ عنہما used to separate quickly from the seller if he had bought a thing which he liked.""",Sales and Trade,Sahih Bukhari,3,Sahih
2108,"Narrated Hakim bin Hizam"" رضی اللہ عنہ :","The Prophet (ﷺ) said, ""The buyer and the seller have the option of canceling or confirming the deal unless they separate."" It is also reported from Abdullaah bin Harith narrated this Hadith.",Sales and Trade,Sahih Bukhari,3,Sahih
2109,Narrated Ibn `Umar رضی اللہ عنہما :,"Allah's Messenger (ﷺ) said, ""The seller and the buyer have the option of canceling or confirming the deal unless they separate, or one of them says to the other, 'Choose (i.e. decide to cancel or confirm the bargain now)."" Perhaps he said, 'Or if it is an optional sale.' """,Sales and Trade,Sahih Bukhari,3,Sahih
